,subreddit,selftext,title
59,Android,,"Ice universe on Twitter: Samsung Exynos1080 will be released in Shanghai, China on November 12. This is the first time Samsung has held a conference for the processor, which means that Samsung has begun to pay attention."
60,Android,[removed],helohelo
61,Android,[removed],BEHIND YOU
62,Android,,What's your take on XDA's new phone?
63,Android,[removed],Disabling Samsung apps
64,Android,[removed],My lock screen keeps changing to whatever the thumbnail of a video that I open on Reddit or watchtogether and I'm sick of it
65,Android,[removed],Lacking storage booting not showing in Android Recovery Mode for S9
66,Android,[removed],Cannot unlock screen unlock
67,Android,[removed],Persistent National voter registration modification after reboot
68,Android,[removed],Google Play Security Update stuck on October 2019
69,Android,[removed],My Galaxy S7 has last almost 4 years and I'm finally upgrading to the S20+
70,Android,[removed],Liquid screen protector on top of a glass screen protector--is it a good idea?
71,Android,,Download 💀Crack Status -PC Games👨‍💻 .APK
72,Android,[removed],Google pay support asking for pic of SSN
73,Android,,"Snapdragon 875 could be 25% faster than its predecessor, leaked AnTuTu result shows"
74,Android,,"Snapdragon 875 could be 25% faster than its predecessor, leaked AnTuTu result shows"
75,Android,[removed],Can i make backup of my pc (windows 10) on my android phone?
76,Android,[removed],Is there anyway to remove emergency calling button from lock screen without root?
77,Android,[removed],Apple Bad
78,Android,[removed],Advice on buying an Android phone
79,Android,[removed],"For people who have android 11, how does it affect microsd card support?"
80,Android,,Mobvoi's TicWatch wearables are up to 33% off today only
81,Android,,DJI's lightweight Mini 2 drone with 4K video tipped to land on November 4
82,Android,[removed],Collect yours opinion about Android 11
83,Android,[removed],I don't even know how to ask this...
84,Android,,Pixel 5 gets mediocre 120 points in DxOMark test
85,Android,[removed],🌟Tap Tap Fish – Abyssrium Pole v1.13.1 (Mod – health) + Obb🌟
86,Android,[removed],Any way to update Airpods via Android or Windows?
87,Android,[removed],Replacement for Google Play Music?
88,Android,[removed],How do I do 3 way split screen on Tab s6
89,Android,[removed],Emergency Calls Only Help
90,Android,[removed],Google Pixel (3) Messages App Issues
91,Android,[removed],Pixel 4a / Pixel 5 or One Plus 8T? And why?
92,Android,[removed],Switched from Pixel 4 XL to Pixel 5. It's not an upgrade or downgrade.
93,Android,,"Android 11 arrives on the Raspberry Pi, thanks to new OmniROM release"
94,Android,,Sony is paying almost one billion dollars to acquire some anime
95,Android,,Trick or Sweep: 12 robo 'costuum' ideas to help Covid Halloween suck less (more?)
96,Android,,30 of the scariest Android games that are perfect for Halloween 2020
97,Android,[removed],Background activity vs background data
98,Android,[removed],What’s better out of Pixel 5 &amp; One Plus 8T. I want a phone that can charge quick and/or has a good battery please. I understand OP 8T has great battery and very fast charger but is the pixel 4a/5 that much more worth it because of the clean software? Thank you.
99,Android,[removed],"What to buy out of these three, Samsung Galaxy S20 FE, OnePlus 8T and Asus ROG 3?"
0,Android,[removed],a site for .apk files?
1,Android,[removed],Are the Samsung A51 or A71 decent lower end phones?
2,Android,[removed],Location service is completely broken 😞
3,Android,[removed],Why does Android still not have a guest mode so I can let a stranger use my phone without them being able to rifle through everything?
4,Android,,OnePlus 8T vs Google Pixel 5 Please Subscribe my channel✌️
5,Android,,Everything you need to know before install apps on Android or iOS - [2020]
6,Android,[removed],is installing android 11 GMS on an android 10 device safe?
7,Android,[removed],Google search bar doesn't use black for dark mode
8,Android,[removed],Do any of the folder syncing applications work reliably?
9,Android,,Micromax teases 'In' branded phone ahead of launch
10,Android,,Sony’s WF-1000XM3 ANC hit their lowest price ever at $168 ($62 off)
11,Android,,The Core i5 Pixel Slate's flash storage is failing for several users
12,Android,,It's Time to be Honest with Myself... [LinusTechTips]
13,Android,[removed],OneUI vs. OxygenOS
14,Android,[removed],Android 11 - Switch System Navigation For One App?
15,Android,[removed],"""Error deleting screen recording"" when ending in-built screen recorder."
16,Android,,Grand Theft Auto 5 Mod Apk
17,Android,[removed],Tenor and giphy gifs. How to uninstall/get rid of them. Samsung s20fe
18,Android,,Pixel 5 vs iPhone night mode showdown
19,Android,[removed],Haptic Feed Games
20,Android,,"Snapdragon 875 could be 25% faster than its predecessor, leaked AnTuTu result shows"
21,Android,[removed],Android 11 add to dictionary annoyance
22,Android,[removed],Stand Alone 5G on Tmobile
23,Android,,Express VPN Pro Crack + Serial Key Free Download
24,Android,[removed],Android Device Malware
25,Android,[removed],GLOBAL GIVEAWAY
26,Android,[removed],Firewall android foreground
27,Android,[removed],Any apps that transfer other apps to sd card?
28,Android,[removed],Help reqd — No haptic feedback on Hey google
29,Android,[removed],Pixel 4a camera issue?
30,Android,[removed],How to stop Drive from opening when using Chrome to open a PDF link?
31,Android,[removed],Turn off Bluetooth auto connect for SOME devices
32,Android,"Note 1. [Check out our apps wiki](https://www.reddit.com/r/Android/wiki/index#wiki_apps) for previous threads and apps curated by the reddit Android community!  

[Download the official /r/Android App Store based on our wiki!](https://github.com/d4rken/reddit-android-appstore/releases)

Note 2. Join us at **/r/MoronicMondayAndroid**, a sub serving as a repository for our retired weekly threads. Just pick any thread and Ctrl-F your way to wisdom! 

Note 2. Join our IRC, and Telegram chat-rooms! [Please see our wiki for instructions.](https://www.reddit.com/r/Android/wiki/index#wiki_.2Fr.2Fandroid_chat_rooms)


***  

This weekly Saturday thread is for:  
* App promotion,  
* App praise/sharing  

***  

**Rules:**  

1) If you are a developer, you may promote your own app ONLY under the bolded, distinguished moderator comment. Users: if you think someone is trying to bypass this rule by promoting their app in the general thread, click the report button so we can take a look!",Saturday APPreciation (Oct 31 2020) - Your weekly app recommendation/request thread!
33,Android,,[OC] The Most Popular Databases - 2006/2020
34,Android,[removed],Any other modded alternatives to the stock Instagram app?
35,Android,[removed],Samsung Galaxy A3
36,Android,[removed],"I will build mobile app developer for your ios,android development apps using xamarin"
37,Android,[removed],Is it safe to install android ISO on PC?
38,Android,[removed],How many years of software updates will the Asus ROG Phone 3 get?
39,Android,[removed],Anyway to use google assistant while the screen is off and locked ?
40,Android,[removed],Invert colours
41,Android,[removed],Samsung M30s Price | Samsung M30s Specification | Review
42,Android,[removed],Can I turn off cellular network while using WiFi calling?
43,Android,,Developing A Popular New Operating System (OS)
44,Android,[removed],Google 5th Gen phones size comparison
45,Android,[removed],"Notifications on Android 10, one UI 2.5"
46,Android,[removed],help pleaseeeeee
47,Android,,Google's lack of foresight and strategy is stifling Pixel sales in India
48,Android,,Google's lack of foresight and strategy is stifling Pixel sales in India
49,Android,[removed],S20 Ultra or Note Ultra?
50,Android,[removed],I sometimes wonder how tapping the build number 7 times makes one a developer?
51,Android,,Google Meet on web at last gets custom virtual background uphold
52,Android,[removed],Receive Texts on Laptop?
53,Android,[removed],USB-C cables. I seen to get intermittent connection with my cables. Any good long lasting heavy duty cables around? What about magnetic ones that support data transfer and Android auto?
54,Android,[removed],Turn on notification light when camera is used by any app on Android
55,Android,[removed],Why is nobody talking about the fact that a half-day battery is the new flagship standard?
56,Android,[removed],About upgrading to Android 10
57,Android,[removed],Is There a 3u tools for Android?
58,Android,[removed],Keep Your Drink Warm for Hours With This Dishwasher-Safe Heated Mug
59,Android,[removed],minecraft on numerous android phones with same account?
60,Android,,Incorporating Custom Fonts in Your Flutter App
61,Android,,Can somebody make this APK?
62,Android,,Download Skeleton | 3D Anatomy .APK
63,Android,[removed],Installing fonts on tab s7+
64,Android,[removed],Simulate Second Display for Desktop Mode?
65,Android,[removed],Is there a way to check what android auto did in my car crash?
66,Android,[removed],[Bug] is it a bug or something ?
67,Android,[removed],Any good music apps that let you download music to your phone default music app.
68,Android,,Samsung Galaxy Z Fold 2 Review: Tablet Killer - MrMobile [Michael Fisher]
69,Android,,Samsung Galaxy Z Fold 2 Review: Tablet Killer - MrMobile [Michael Fisher]
70,Android,[removed],Android phone makers dont give us what we actually want
71,Android,,Unboxing: Pixel 5
72,Android,[removed],Bionic Commando - Alien Shooter – Survival Game
73,Android,,"Xiaomi Redmi Note 9S Specifications and specifications, test, reviews"
74,Android,[removed],Urgent Help needed with custom ROM flashing
75,Android,,"Google Pixel 4a, finally official before the next Pixel 4a (5G) and Pixel 5"
76,Android,[removed],hyperlink texts and previews no longer appearing in text/sms. pixel 4 XL android 11. thanks
77,Android,[removed],Calendar setting month with day schedule
78,Android,,"Gears POP has proven to be the failure everyone expected, closing next April"
79,Android,[removed],Mobile Data/Phone Service Restored Notification Audible
80,Android,,Iphone 12 pro thermal trottling? This is BAD! (compared to the galaxy z fold 2)
81,Android,[removed],How is RCS messaging coming along?
82,Android,,In Previous Article We shared procedure to download flash files for Mi Phones and today we are here with the procedure to Flash Mi Smartphones using Xiaomi MI Flash Tool. This process can be used to flash or install the stock firmware on any Xiaomi Smartphone and Tablets.
83,Android,[removed],Samsung Galaxy A71 or Samsung Galaxy Note 10 lite? Which one will be better overall?
84,Android,[removed],do you guys use multiple google apps on your phone?
85,Android,[removed],"All Android devices that I have: G1, Nexus One, Nexus 4, Pixel OG, and Pixel 5"
86,Android,,Is Samsung Ecosystem the Android answer to Apple's Ecosystem?
87,Android,[removed],One thing YouTube Music does better than Play Music
88,Android,[removed],Is there a way to reduce compression of photos/videos sent over MMS?
89,Android,,Google Messages conversation categories are about to roll out
90,Android,,Iphone 12 pro thermal throttling. This is BAD! (compared with z fold 2)
91,Android,[removed],4:3 Android Tablet
92,Android,,Amazon is opening every Motorola Razr box to fold the phone for safer shipping
93,Android,,Google Messages conversation categories are about to roll out
94,Android,,T-Mobile welcomes the LG Wing with a BOGO offer starting November 6
95,Android,,24 temporarily free and 57 on-sale apps and games for Friday
96,Android,[removed],Google Support just confirmed that movies purchased from Google can be removed at any time and there will be no refunds or credits
97,Android,,Top 9 Android Apps of 2020
98,Android,,A high IQ move from Apple to gain more profit? What are your views?
99,Android,[removed],Constant Texting problem with family members iPhones
0,Android,[removed],How to Revert Gmail Icon
1,Android,[removed],Is the Samsung s8 or the Moto g power better?
2,Android,[removed],Android Game Controllers: Top 8 Reviews (2020)
3,Android,[removed],LG G8 rotation stuck
4,Android,[removed],I tested the Pixel 4XL against the iPhone 12 Pro and the iPhone 11 Pro in low light. Here are the results.
5,Android,[removed],Google will leave you hung out to dry during a pandemic
6,Android,,WhatsApp is now delivering roughly 100 billion messages a day
7,Android,,The OnePlus 9 could be headed to Verizon and T-Mobile in the USA
8,Android,,Facebook begins publicly testing Dark Mode for its official Android app
9,Android,,Google Messages conversation categories are about to roll out
10,Android,[removed],"[DEV] Qoach, your new (quarantine) workout partner!"
11,Android,[removed],Internet connection
12,Android,,Replace your Laptop with an Android Tablet *for 90% of what you do
13,Android,[removed],A71 dropping wifi when locked since last security update
14,Android,,Google Maps 10.53.1 prepares to add a language changer and Google Assistant driving mode
15,Android,[removed],Split screen problems
16,Android,[removed],Downloading on Chrome
17,Android,[removed],Does the music stop playing automatically when you take 1 Airpod Pro out of your ear on android 8?
18,Android,[removed],Storage space running out
19,Android,[removed],Does anyone still have a copy of ICS Root 2?
20,Android,,Sundar Pichai teases Google’s deeper hardware investments - 9to5Google
21,Android,,Best Apps 2020 (Techtober) October
22,Android,,OnePlus NORD N100: Bad Move!
23,Android,,Samsung reveals One UI 3 features (Released November 2020 or Later)
24,Android,[removed],5g on my new s20+ 5g
25,Android,,My first videogame
26,Android,,"Telegram: Pinned Messages 2.0, Improved Live Locations, Playlists and More"
27,Android,,Samsung overtakes Amazon to become world's second-largest tablet brand
28,Android,,Found the best minimalist launcher!!!
29,Android,,"Apple Slips to Fourth Place for Smartphone Market Share, Overtaken by Xiaomi"
30,Android,,Introduction to Android Studio
31,Android,[removed],Have you ever dug out your first few Android phones to see how they stack up?
32,Android,[removed],"""technical-support, upgrade related questions, app recommendations and carrier-related issues should be asked in their respective subreddits!"""
33,Android,[removed],Android App for playing music that is downloaded on my device
34,Android,,OnePlus NORD N100: Bad Move!
35,Android,,DXO Mark camera review of the Pixel 5
36,Android,[removed],Choose for me
37,Android,[removed],Automatically disable dual SIM?
38,Android,,Report: Xiaomi beats Apple to become world’s third biggest smartphone firm
39,Android,,"VPN by Google One: A VPN for Android, by Google"
40,Android,,Hotel Shreehari
41,Android,[removed],Looking for an e-reader app
42,Android,,The Xiaomi Mi 10T Pro is proof that a great LCD is better than a good AMOLED
43,Android,[removed],Android should allow us to have transparent status bar for all apps
44,Android,[removed],Alphabetical notebook app
45,Android,,Project Fi promises privacy with Google-run VPN
46,Android,,"POCO X3, Redmi Note 9 Pro Max, and 10 others now support augmented reality apps via ARCore."
47,Android,,Samsung recaptures No. 1 spot in Q3 smartphone market: report
48,Android,,"Samsung Reclaims the Top Spot as Smartphone Market Performs Better Than Expected with 353.6 Million Device Shipments in 3Q20, According to IDC"
49,Android,[removed],"all the Indians in this sub, you sure don't wanna miss this!"
50,Android,[removed],Maybe “Batchat” is the most secure private chat app at present(end-end encrypted) better than telegram and wechat
51,Android,,Replace your Laptop with an Android Tablet *for 90% of what you do
52,Android,,Hasleo BitLocker Anywhere Crack With License Key Free Download
53,Android,,"Samsung Launches SmartThings Find, a New Way to Quickly and Easily Locate Your Galaxy Devices"
54,Android,[removed],Where Do We Buy Music Now?
55,Android,[removed],Looking for an app that lets me display my screen as a camera input.
56,Android,,The end of existence: 2050-2100 Transform
57,Android,[removed],Stopping battery charging when battery reaches XX%?
58,Android,,SNAPDRAGON 870 SOC WILL BE EXCLUSIVE FOR OPPO SMARTPHONES
59,Android,[removed],HELP! ANDROID 10 AUDIO DRIVER PROBLEM.
60,Android,[removed],low level security discord server
61,Android,,06 Feature's why Google Duo is Perfect with Video Conferencing
62,Android,[removed],Just my .02 on a beastly phone - V60
63,Android,[removed],Dream phone
64,Android,[removed],Apple music installed without me knowing
65,Android,[removed],"Does google make ""they grow up so fast"" type videos on samsung devices?"
66,Android,[removed],I've only ever used android phones. After using iOS on my work phone... Does anyone else think that iOS predictive text and keyboard smokes anything on android?
67,Android,[removed],Upgrading Samsung S8
68,Android,[removed],IOS Snapchat for Android
69,Android,[removed],TC -Screen Mirroring at its Best
70,Android,[removed],Ok I nerroeed it down to these 3 I would go for samsung but software support is wack
71,Android,,Google is finally considering adding controller rumble support to Android
72,Android,,Google App preps “Assistant Memory” and At A Glance media recommendations
73,Android,[removed],"I'm I blind or something, I can't tell the difference between 120hz and 60hz"
74,Android,[removed],"I'm I blind or something, I can't tell the difference between 120hz and 60hz"
75,Android,[removed],Pixel 5 snapchat notifications not working
76,Android,[removed],Looking for mp4 / media player which saves the last watched episode like netflix etc
77,Android,[removed],Is 4.4 hours screen on time good?
78,Android,,Which Phone is the Right Fit for You? Smartphone Shopping Guide!
79,Android,[removed],so i wet the bed and my phone was lying next to me
80,Android,,Should we change the way we classify smartphones?
81,Android,,Download NBA 2K Mobile Basketball .APK
82,Android,[removed],Android app idea - Helping Hands - The app that allows users to donate the same monthly amount to a common charity fund. Users vote to decide which single charity gets the funds each month. The app will provide benefit analysis for prospective causes as well as a forum for debate.
83,Android,[removed],Anyone using Web Messages on Mac OS X and have notifcations working?
84,Android,[removed],Tryingn to Recover Photos from a Dead Samsung Galaxy S6
85,Android,,cheel ueel
86,Android,,Google May Be Working On Scrolling Screenshot For Chrome on Android
87,Android,,Google makes it easier to adjust Pixel 5 'Vibration &amp; haptics' - 9to5Google
88,Android,[removed],Custom gif as charging animation
89,Android,[removed],downloading apps to pc using a web browser NOT bluestacks or nox
90,Android,[removed],[Question] Can obb files have virus? If so how to check?
91,Android,,LG K92 5G announced for the US
92,Android,[removed],How long will an unopened phone last without being charged?
93,Android,,Amazon is opening brand-new Razr boxes to fold the phones for safer shipping
94,Android,[removed],Messages: Random string of letters after messages that I receive
95,Android,[removed],Microphone booster app
96,Android,[removed],Would love feedback/ reviews for my app titroo
97,Android,[removed],Google android icons don't match
98,Android,[removed],What's the best app/method to self destruct wipe phone in case it gets stolen?
99,Android,[removed],Waterproofing
0,Android,[removed],"Pulse SMS, an open source Android SMS app has been acquired."
1,Android,[removed],Forcefully update phone to Android 10
2,Android,[removed],Galaxy S20 FE haptic feedback question
3,Android,,More online protection with the new VPN by Google One
4,Android,[removed],Narrator mode for Android apps
5,Android,[removed],Messages 6.9.085(Beta) update reset all contact notification sounds to default.
6,Android,,"Google 'updates' Docs, Sheets, and Slides app icons by placing them on big white plates"
7,Android,,Tip: Android 11's built-in screen recorder also works for voice calls
8,Android,[removed],How do you buy music now?
9,Android,[removed],ROM that is always updating
10,Android,[removed],Help Please!!
11,Android,,100-off-the-complete-android-ethical-hacking-practical-course-caehp-2/
12,Android,[removed],Dear smartphone manufacturers
13,Android,[removed],How to backup Data without Root and PC
14,Android,[removed],Giving Google Assistant commands via car stereo
15,Android,[removed],wallpapers turn darker when i have dark theme on
16,Android,[removed],[ASK] Bluetooth Not Working Properly on Xiaomi Redmi Note 3
17,Android,[removed],Does Android TRIM storage often?
18,Android,[removed],my teacher needs us to use imovie for a project. i dont have any apple device. does anyone know any other app for desktop or mobile?
19,Android,,Samsung rolls out the November 2020 security update to the Galaxy Z Fold 2
20,Android,,India Smartphone Market Clocks Highest-ever Shipments in Single Quarter
21,Android,[removed],"New Android user, looking to replace S20 OS with stock Android OS"
22,Android,[removed],What are your favorites magisk modules?
23,Android,[removed],Note 10+ Gcam front camera stopped working ever since update One UI 2.5
24,Android,,Cyber security month 2020: the importance of it and why you should be interested
25,Android,,"Google 'updates' Docs, Sheets, and Slides app icons by placing them on big white plates"
26,Android,[removed],"How can I transfer Photos and Videos to My SD Card without changing the ""Photo Taken date"". (Samsung Galaxy S9)"
27,Android,[removed],"Help, my boss cannot call me on my Galaxy 8"
28,Android,[removed],Urgent help please
29,Android,,[TechAltar] Why Xiaomi is so bad at names.
30,Android,[removed],Ringtone suddenly much more rapid
31,Android,,You can finally hide liked YouTube videos in YouTube Music
32,Android,,Sony redesigns the PlayStation app with a new look and exclusive PS5 features (APK Download)
33,Android,[removed],"Does anyone know a similar app to ""Noted App""?"
34,Android,,Tip: Android 11's built-in screen recorder also works for voice calls
35,Android,[removed],My gallery albums are disappearing.
36,Android,,Samsung recaptures top spot in Indian smartphone market in Q3: report
37,Android,[removed],Timeline of Oneplus devices getting OxygenOS 11.
38,Android,[removed],Timeline of Oneplus devices getting OxygenOS 11.
39,Android,[removed],Item feed like twitter for a user
40,Android,[removed],Accessibility in Android applications
41,Android,,"RIP Google Play Music, 2011 – 2020"
42,Android,,Were 4 rear cameras not enough? It would have been better if manufacturers concentrated on improving cameras that are already present rather than adding more cameras.
43,Android,,Pixel 4a 5g Available For PreOrder
44,Android,,Why Xiaomi names are such a mess!
45,Android,,LG Grandeur
46,Android,[removed],Weird fonts in S8+
47,Android,,Counterpoint: Samsung reclaims top spot in India as country sees record smartphone shipments - GSMArena.com news
48,Android,[removed],low level security discord server
49,Android,,Raspberry Pi 4 gets a taste of Android 11 via OmniROM
50,Android,[removed],Why would an online buyer want the phone's PCB number?
51,Android,[removed],Google drives sending me spam notifications
52,Android,"**Credits to the team at /r/PickAnAndroidForMe for compiling this information:**

* Home - https://www.reddit.com/r/PickAnAndroidForMe/wiki/index

* Smartphones 101 - https://www.reddit.com/r/PickAnAndroidForMe/wiki/smartphones101

* Top Phones - https://www.reddit.com/r/PickAnAndroidForMe/wiki/phones


***        
Note 1. Join us at /r/MoronicMondayAndroid, a sub serving as a repository for our retired weekly threads. Just pick any thread and Ctrl-F your way to wisdom! 

Note 2. Join our IRC, and Telegram chat-rooms! [Please see our wiki for instructions.](https://www.reddit.com/r/Android/wiki/index#wiki_.2Fr.2Fandroid_chat_rooms)",What should I buy Thursday (Oct 29 2020) - Your weekly device inquiry thread!
53,Android,,Download Game Controller 2 Touch PRO .APK
54,Android,,MiniTool Power Data Recovery Crack +Serial Key Free Download
55,Android,[removed],Best Indie Wallpaper Apps or Sites ?
56,Android,,Good news for Huawei’s smartphone business as US reportedly allows chip sales
57,Android,,From XDA to Cyanogenmod to LineageOS: A brief history
58,Android,,Samsung posts record Q3 2020 revenues as foldables gain momentum
59,Android,[removed],Reddit Discover for Android Launchers
60,Android,[removed],10244 element draining battery in Android
61,Android,,US allows sales of chips to Huawei’s non-5G businesses
62,Android,,Samsung posts highest revenue ever after boost in flagship phone sales
63,Android,[removed],A question about the android boot up screen
64,Android,,Google compares similar apps head-to-head in new Play Store experiment
65,Android,[removed],Phone issue
66,Android,[removed],"OneDrive, Google Drive, Amazon Photos??? Needing a ""cloud"" service but I am beyond clueless."
67,Android,[removed],Please help me recompile scrcpy
68,Android,[removed],Is there any way to know how much real battery capacity left throughout of 2 years use of my Mi8?
69,Android,[removed],When is Nokia 9.3 Pureview releasing??
70,Android,[removed],Top notch live wallpapers for android
71,Android,[removed],Mobile review videos are becoming monotonous
72,Android,[removed],Any tips for recovering Google account please?
73,Android,[removed],How to prevent app from detecting unlocked bootloader?
74,Android,[removed],Mobile Application Development Trends to Watch in COVID-19 Era
75,Android,[removed],What is the value proposition of S20 FE?
76,Android,,Google is working on scrolling screenshot support for Chrome on Android
77,Android,[deleted],Full Webpage (Scrolling) Screenshot Coming to Chrome for Android?
78,Android,[removed],all in one videio downloader
79,Android,[removed],Android Messages
80,Android,[removed],I want to root an. Motorola G6 play but I don't know how.
