,subreddit,selftext,title
72,Android,[removed],Is Samsung the only Android Manufacturer without a single flop that wasn’t made right?
73,Android,,Google Pixel 4a volume troubles. (namely call volume being too loud) Anybody got a solution? One of the guys in the forum just straight up yeeted his phone.
74,Android,[removed],Phone in developer build
75,Android,[removed],Texts not showing up on new phone with same sim card
76,Android,[removed],Custom full phone sync
77,Android,,"Shade Launcher - Lightweight, free, open source &amp; very smooth"
78,Android,,"How to fix this? On Google Pixel 2 phone. None of the options work, not even the factory reset option. Each option I choose goes right back to this screen. Ideas?"
79,Android,[removed],"My LGv30 had a update a few days ago, now battery drains at around 3x the speed."
80,Android,[removed],OneDrive music local folder question
81,Android,[removed],Need the help
82,Android,,Google Fit removes advanced weight training tracking on Wear OS
83,Android,[removed],Can Android phone cameras compete with Iphone cameras?
84,Android,[removed],Droid Mini alternative (with standalone capacity buttons under the screen)?
85,Android,[removed],Strange file in Samsung galaxy s9
86,Android,[removed],Fossil 5 gen
87,Android,[removed],Mobile data not working on Samsung Galaxy A3 2017. Help!
88,Android,[removed],Moto g power
89,Android,[removed],Anyone here with the Z fold 2 frequent the beach?
90,Android,[removed],MAKE MONEY ONLINE
91,Android,,"Redmi Watch announced with 1.4"" 323PPI display, NFC, 7 days battery life (269¥/41$), to launch globally as Mi Watch Lite"
92,Android,,Huawei lost most of its shares (20%→8.8%) in Western Europe in Q3 but it's to Xiaomi &amp; OPPO's gain - IDC
93,Android,[removed],Nexus 4
94,Android,[removed],Is there an app to boomerang ideas?
95,Android,[removed],Lost Android phone
96,Android,[removed],What's the best Android phone that one can buy today purely in terms of build quality in the USA?
97,Android,[removed],"AMA Announcements: Frank Monza (30th of November, 3 pm UTC/4 pm CEST/10 am EST/7 am PST) and Dieter Bohn (2nd of December, 5 pm UTC/6 pm CEST/12 pm EST/9 am PST)"
98,Android,[removed],Hey Google sensitivity extremly bad. Anyone else?
99,Android,[removed],What was the worst Android phone you owned?
0,Android,[removed],I MADE MY OWN PHONE (It's called the CorePhone)
1,Android,[removed],Home screen shortcut
2,Android,[removed],Please help!
3,Android,[removed],"Google opinion rewards dont work for me, when i go to permissions, only option is toggling camera, it wont send me surveys"
4,Android,[removed],Unexplained notification tones
5,Android,[removed],Really love my Android except this one big issue
6,Android,[removed],Looking for app suggestions
7,Android,[removed],Leather case for phones
8,Android,,Introduction to Android | Mobile Application Development | Urdu / Hindi...
9,Android,[removed],Does the Galaxy S20 FE 5G exist with 8GB of RAM?
10,Android,[removed],Wireless earphones?
11,Android,[removed],Google Chrome pink tint
12,Android,[removed],The latest Vivo Y1s doesn't integrate a gaming processor from MediaTek
13,Android,[removed],Galaxy Note 9 just got updated with wireless DEX support.
14,Android,,Download F1 Mobile Racing .APK
15,Android,[removed],Hydrogel vs Plastic screen protector (Or did I get scammed?)
16,Android,,how vpn unblock the sites - unblock websites - ip changer
17,Android,,best vpn of unblock sites - unblock vpn
18,Android,,kiwi vpn
19,Android,[removed],Help me scale my volume
20,Android,[removed],Google Assistent not working on Samsung galaxy
21,Android,,Parliament wants to grant EU consumers a “right to repair” | News | European Parliament
22,Android,[removed],I often buy google smartphones with Yoybuy- taobao agent.
23,Android,,Features of Android 11
24,Android,[removed],"App to make quick notes, replacing social media statuses/posts"
25,Android,[removed],RuntimeException when using mapbox-android-plugin-places-v9:0.12.0
26,Android,[removed],Did any android companies annouced they will be making a mini phone?(Something to rival apple's iPhone 12 mini)
27,Android,[removed],What’s the best Spotify equaliser?
28,Android,,"Xiaomo POCO M3 Philippines Price, Specs, Features, and Launch Discount Promo Details"
29,Android,[removed],Creating a bare bones Android phone.
30,Android,[removed],Mobile display
31,Android,[removed],APK Audio file extraction
32,Android,[removed],Anyone know what app this icon is?
33,Android,,Vivo unveils Origin Os - Will it be less polarizing than the previous one?
34,Android,,Vivo unveils Origin Os - Will it be less polarizing than the previous one?
35,Android,,How much cost for making an app like Flipkart?
36,Android,[removed],Export Whatsapp Chat to Readable PDF or JPEG....
37,Android,[removed],Mobile app
38,Android,[removed],Buying new phone
39,Android,[removed],Changing gmail account on motorola phone
40,Android,[removed],What is the best phone 200$ can buy you?
41,Android,[removed],Help please
42,Android,[removed],Which 600-700$ android device should i get?
43,Android,[removed],What music player do you use and why?
44,Android,,Download Weed Farmer University .APK
45,Android,[removed],Turn On Auto Sync nagging reminder
46,Android,[removed],Pixel 5 Fi vs Unlocked
47,Android,[removed],"How to retain Free Unlimited ""High Quality"" Google Photos Backup past June 2021."
48,Android,[removed],I have a huawei p20 pro is it worth it get airpods (2nd generation)?
49,Android,[removed],"Are high-speed/high-capacity (A1, A2, U3) microSD cards worth it for Android? With Black Friday and Cyber Monday deals coming up, I (re)tested 5 of those and 2 older ones in 3 quite different Android phones"
50,Android,[removed],Camera keeps stopping/front facing camera broken
51,Android,[removed],How to calculate the Watts of the wall adapter?
52,Android,[removed],Diskdigger
53,Android,[removed],Can i recover pics deleted from (recently deleted)? If yes how?
54,Android,[removed],Where can I store my 100gb worth of stuff without using a microsd?
55,Android,[removed],Which is the best cheapest /free floating notes app for Android?
56,Android,[removed],🚨 PLEASE HELP 🚨
57,Android,,LTT: Chromecast with Google TV
58,Android,[removed],3 worst things about Google stopping it's unlimited photos storage...
59,Android,[removed],Scared kinda to switch froms Samsung to google. Inform me please.
60,Android,[removed],"Called 911, can't clear location request"
61,Android,[removed],Hotspot won't turn on
62,Android,[removed],Best tools for android (any kind of tools) with description
63,Android,[removed],Dark Mode Now Available for Flipboard Android Users
64,Android,,Mobvoi give away
65,Android,[removed],Among Us Mod Apk - Hack Android
66,Android,,Among Us Mod Apk - Android Hacks
67,Android,[removed],Screenshots not showing in gallery
68,Android,,HarmonyOS The New Operating System Vs. Android
69,Android,[removed],Can someone explain to me the Android Runtime layer?
70,Android,[removed],Device root OEM Unlocking Nokia 6.1 (2018)
71,Android,[removed],Samsung's new 'Secure Wi-Fi' button automatically enables location services - Remember to turn that off!
72,Android,,Samsung Galaxy A12 and Samsung Galaxy A02s are Samsung's newest budget devices
73,Android,[removed],What is Go App?
74,Android,[removed],Android headset controller
75,Android,,I show you how to play super mario on android :)
76,Android,[removed],If u block someone..Will his text show up for me in group texts?
77,Android,[removed],App to connect Bluetooth headphones to a PC with no Bluetooth
78,Android,,Nokia 2.4 hands-on - GSMArena
79,Android,,Redmi Note 9 5G series announced: 5G and 108MP Isocell HM2 starting at ~$250
80,Android,[removed],Why is the market switching to LTPS LCD displays instead of AMOLED
81,Android,[removed],Do manufacturers really ‘slow their phones down’?
82,Android,[removed],"Are there any Apps or Launchers where you can have ""Hidden"" Wallpapers like Iphone has?"
83,Android,[removed],Opening side menu
84,Android,,Smashy Ball is available on Google Play!
85,Android,[removed],Twitter app shows only up to 24 tweets notifications?
86,Android,,[TechAltar] I switched to the Fold 2 - here's what I've learned
87,Android,[removed],Where is the setting to silence notifications only when Im using the phone?
88,Android,[removed],deceased friends password bypass
89,Android,[removed],Adblock and useful apps?
90,Android,[removed],Offline Experience Vs Online Experience While Purchasing Furniture
91,Android,,"Cherry Mobile Aqua S9 Max Price, Specs, and Launch Promo Freebies, Officially Announced!"
92,Android,[removed],Lots of Issues with Texting
93,Android,,Download Piano Tiles 2™ .APK
94,Android,[removed],Samsung 3 Watch Need Help
95,Android,,I switched to the Fold 2 - here's what I've learned - YouTube - TechAltar
96,Android,,I switched to the Fold 2 - here's what I've learned - YouTube - TechAltar
97,Android,"**Credits to the team at /r/PickAnAndroidForMe for compiling this information:**

* Home - https://www.reddit.com/r/PickAnAndroidForMe/wiki/index

* Smartphones 101 - https://www.reddit.com/r/PickAnAndroidForMe/wiki/smartphones101

* Top Phones - https://www.reddit.com/r/PickAnAndroidForMe/wiki/phones


***        
Note 1. Join us at /r/MoronicMondayAndroid, a sub serving as a repository for our retired weekly threads. Just pick any thread and Ctrl-F your way to wisdom! 

Note 2. Join our IRC, and Telegram chat-rooms! [Please see our wiki for instructions.](https://www.reddit.com/r/Android/wiki/index#wiki_.2Fr.2Fandroid_chat_rooms)",What should I buy Thursday (Nov 26 2020) - Your weekly device inquiry thread!
98,Android,[removed],i want someone help me please if you have time please
99,Android,[removed],six THIRTY not THIRDNEY
0,Android,[removed],Best TWS?
1,Android,[removed],My alarm clock read aloud voice is EXTRENELY COMPLUZING
2,Android,[removed],Xiaomi mi 10t pro graphics and animations make it stutter in game.
3,Android,[removed],Is it necessary for Google to have access to location at all times
4,Android,,"Android App Bundles could have a drawback for developers, power users"
5,Android,[removed],"Join us on a live hiring experience with CoinGecko - ""A Global Leader in Tracking Cryptocurrency Data!"""
6,Android,,Exclusive: Galaxy S21 features to include Bixby Voice as a biometric option
7,Android,[removed],"Hey, guys please give it try to my first puzzle game. Feedback will be appreciated"
8,Android,[removed],"ADB Bloatware Uninstall Safe List for Samsung, Verizon and Google apps (Galaxy A50)"
9,Android,,Plant Shop Android Studio UI 2020
10,Android,[removed],Do Google Pixel's also have good video capabilities?
11,Android,[removed],Finding an app to remote access phones for a business.
12,Android,,Plant Shop Android Studio UI 2020
13,Android,,Samsung Galaxy F41 review: Feature-rich mid-range phone
14,Android,,New software update for Asus zenfone 5z with added Support for T-Mobile volte and jio vowifi.
15,Android,,Microsoft could bring Android apps to the Windows desktop in 2021
16,Android,[removed],Syncing Contacts
17,Android,[removed],Beware: DT Ignite/Mobile Services Manager now seems to be built into Samsung's Galaxy Apps.
18,Android,[removed],Samsung s20 fe camera
19,Android,[removed],Black Friday Software Deals
20,Android,[removed],Are the Pixel devices not going on Black Friday sale this year in Canada?
21,Android,,Microsoft could bring Android apps to the Windows desktop in 2021
22,Android,[removed],S7 vs A71
23,Android,[removed],Is there not a way to fully disable Bixby?
24,Android,[removed],Pull me back from the edge... I'm switching to Apple.
25,Android,,Google is working to speed up installing important apps on a new Android phone
26,Android,,Download Dancing Line .APK
27,Android,[removed],"Help: The neighbour's Chromecast connection shows up on my phone, and I'm concerned that I'm being spied on."
28,Android,[removed],What stylus should I get for drawing on a 10 inch Samsung Galaxy Tab A?
29,Android,[removed],Google Messages RCS enabling
30,Android,[removed],RSNAV ANDROID UNIT
31,Android,[removed],Netflix only max out 720/1080p
32,Android,[removed],Broadcast emergency message (Amber alerts)
33,Android,[removed],Is buying a new Huawei phone worth it even if they don't have the PlayStore??
34,Android,[removed],Can apps detect whether the bootloader is unlocked?
35,Android,[removed],Browser with backwards and forwards key
36,Android,,Realme 7 5G review
37,Android,[removed],TWRP question
38,Android,[removed],"Due to a contest at work, I can get myself a present with a budget of 300 dollars. What phone should I buy?"
39,Android,[removed],Sync home screen and app drawer icons?
40,Android,[removed],question about android 10 navigation bar
41,Android,[removed],need help with getting a new phone
42,Android,https://lineageos.org/,[AMA] We're LineageOS - Developers of the most popular custom Android OS. Ask us anything!
43,Android,,"First Android Game ""Apple Isaac"" ...,"
44,Android,,Nokia's failure is the final nail in the coffin for Android One
45,Android,[removed],Why Android Tablets Failed
46,Android,[removed],Magisk and Santander UK Mobile Banking
47,Android,[removed],Does your phone get snappier with UFS (vs emmc)?
48,Android,[removed],Game driver
49,Android,[removed],"Crowdfunding: P2P notes for Windows, Android and iOS with local sync"
50,Android,,Google TV app no longer shows content available on Netflix
51,Android,,Microsoft may bring Android app support to Windows
52,Android,,Report: Microsoft could bring Android apps to Windows 10 in 2021
53,Android,[removed],Oppo A72 home screen app placement
54,Android,[removed],Interested in getting and Android again
55,Android,[removed],"Suggest me one single android phone that is best for Snapchat , Reddit , Instagram I'll buy that next month n post it on this community"
56,Android,[removed],The fastest way to charge a QC4+ device? QC vs PD?
57,Android,[removed],Anyone using Google Play Family for sharing apps with friends?
58,Android,,[Rumoured]Microsoft could bring Android apps to the Windows desktop in 2021
59,Android,,Windroid 10
60,Android,[removed],Anybody here use TeuxDeux? I made an Android app for it
61,Android,,Samsung’s budget Galaxy A12 and A02s are all about big screens and hefty batteries
62,Android,[removed],Does your smartphone ever reach its advertised charging wattage?
63,Android,,iPhone 12 vs 4 Year Old Android Camera Shootout - YouTube - Gary Explains
64,Android,,iPhone 12 vs 4 Year Old Android Camera Shootout - YouTube
65,Android,,3 Most Important Apps for Students
66,Android,[removed],(How) Can I change specific build.prop entries in a rom build?
67,Android,[removed],Is it safe to Wipe free space on Android?
68,Android,[removed],What are your must have apps?
69,Android,[removed],What do you think is the best mid-range phone with a great OLED display for someone who only uses their phone for reddit and youtube?
70,Android,,Report: Microsoft could bring Android apps to Windows 10 in 2021
71,Android,,Google will make the Android Runtime (ART) a Mainline module in Android 12
72,Android,[removed],What is your daily average screen time?
73,Android,[removed],Best Android apps that are not on the Google Play Store (2020)
74,Android,,"Mishaal Rahman on Twitter: As spotted by @luca020400 , Google will finally make the Android Runtime (ART) into a Mainline module for Android 12"
75,Android,,Is this possible to use all apps except YouTube with vpn
76,Android,,WiperSoft 1.2.1 Crack With Activation Code Free Download [2021]
77,Android,[removed],"Please try my text-to-speech app, Primer, and provide me with your feedback"
78,Android,[removed],Thinking of buying a new phone. Can you give some advice?
79,Android,[removed],build error
80,Android,[removed],"Replace Chinese Phone UI, increase security?"
81,Android,[removed],Smart View feature HELP!!
82,Android,[removed],"Can't find the app on Play Store, my device is compatible but says that it isn't."
83,Android,[removed],Phone prices are ridiculous
84,Android,[removed],Help pls. I’m trying to flash a custom recovery mode but my nexus 7simply won’t go into recovery mode all of a sudden. On the no command screen the buttons stop working so I can’t get the options
85,Android,,"Foldable display, boxy edges and blade bezels, could this be really the next Samsung s21 design?"
86,Android,,Flutter Functions Part 1
87,Android,[removed],Weird SD Card problem
88,Android,[removed],Question
89,Android,[removed],3GB of thumbnail index file i cant get rid of!
90,Android,[removed],[Q] Preinstalled bloatware
91,Android,[removed],Flash flood warning notification from Google keeps coming back...
92,Android,[removed],1440p Oled Display vs 1080p Amoled Display
93,Android,[removed],Can you login to a Google account on a mobile device for a specific app - without granting full account access to that device?
94,Android,[removed],Hiding folders in Android and Windows Explorer
95,Android,[removed],Looking for an App.
96,Android,[removed],New to android and random apps keep downloading to my phone with out me downloading it (LGv30)
97,Android,[removed],Contact's google chat changed to sms?
98,Android,,Android Runtime becoming a Project Mainline module for easy updates in Android 12
99,Android,[removed],Game Console or Samsung Galaxy S20 FE 5G for student entering the 12th Grade
0,Android,[removed],"I just got a Coolpad Legacy SR, and need help with something."
1,Android,[removed],can only view certain pictures through samsung internet
2,Android,[removed],Convert old Android tablet to windows drawing pad without using apps?
3,Android,[removed],How to save multiple numbers as one contact?
4,Android,[removed],What phone spec determines how fast a app startups?
5,Android,,New Tomb Raider Game to Launch on Mobile 2021
6,Android,[removed],Turn off in-app vibrations. HELP!
7,Android,[removed],Hard to find &lt;6 inch phones nowadays?
8,Android,[removed],Burning discs from android
9,Android,,How to boot vivo y11(2019) into EDL mode through test point
10,Android,[removed],New to Android. Tweaks to change system ui like Jailbreak tweaks
11,Android,[removed],I’m an Apple guy trying to help an Android rookie over Whatsapp messenger
12,Android,[removed],Note 3 Sim unlock
13,Android,[removed],How can I make Android 10 look like Pie again?
14,Android,,Google Pixel 5 Display Review: Worthy of a Flagship
15,Android,[removed],Made the switch from iphone
16,Android,[removed],Photos with Google assistant
17,Android,[removed],Google assistant - take a photo
18,Android,[removed],"Phones known for great, high quality video? and specs to look for"
19,Android,[removed],Does anyone know how to make the camera less contrast?
20,Android,[removed],"[Huawei p20 Lite] Obnoxious ""Phone Manager"" app banner spam every minute, ignores ALL notifications."
21,Android,,Google Pixel 5 Display Review: Worthy of a Flagship
22,Android,[removed],"Importing pictures to PC, but not from apps?"
23,Android,[removed],Using multipoint connectivity on Vivo TWS
24,Android,[removed],App transferring
25,Android,,5 Best Free Video editing apps on android from you can export HD quality videos without watermark
26,Android,[removed],Anyone else tired of how much instagram and snapchat kills image quality?
27,Android,,Android's Best Private Browsers go through a Simple Privacy Test
28,Android,,Poco goes indepentenly.
29,Android,,Poco goes indepentenly.
30,Android,,Poco M3 Unboxing + First Look: $129 For Black Friday! - YouTube
31,Android,,Poco M3 Unboxing + First Look: $129 For Black Friday! - YouTube
32,Android,[removed],Redirect all Audio-Output to Bluetooth-Device
33,Android,[removed],android
34,Android,[removed],(OOS 11) YouTube app bugged / not functioning as intended?
35,Android,,"Poco M3 is official with 6,000mAh battery that can charge other devices"
36,Android,,Indian Government bans 43 more mobile apps including AliExpress
37,Android,[removed],Good trade? NOTE 8 and $250 for Note 10
38,Android,,How to create secured banking mobile apps with blockchain
39,Android,[removed],Lock screen notifications
40,Android,,Google prepares to decouple new emojis from Android system updates
41,Android,,Google testing paid crowdsourcing service ‘Task Mate’
42,Android,[removed],Black Friday
43,Android,,Download Clean Master Lite – For Low-End Phones .APK
44,Android,[removed],Force high refresh rates over HDMI
45,Android,[removed],Do you need a Backend pratical and easy to use ?
46,Android,,"Gartner: Q3 smartphone gross sales down 5.7% to 366M, stemming Covid-19 declines earlier this 12 months"
47,Android,,Driver Toolkit Crack With License Key Download [2021]
48,Android,,Google launches new app in India that will pay users to complete random tasks
49,Android,[removed],Smart Widget Stack for Android?
50,Android,,Petition not to kill the Samsung's Note lineup
51,Android,,The iOS learning curve VS Android
52,Android,[removed],Apps Have Disappeared From Home Screen
53,Android,[removed],searching for a phone
54,Android,[removed],Is there a way to program a hotkey on a phone to start and stop audio recording?
55,Android,[removed],Pop up view
56,Android,[removed],Any way to tell what app is using Google Play Services?
57,Android,[removed],Just found out oneplus stole my marketing idea
58,Android,[removed],Bluetooth auto play
59,Android,[removed],External links won't open in their apps from Messenger
60,Android,[removed],Samsung Galaxy a71 5g stuck with only 2g phone data
61,Android,[removed],where to buy OEM unlockable phones?
62,Android,,Updates to Google Fit on Wear OS
63,Android,,"Download CM Security Open VPN – Free, fast unlimited proxy .APK"
64,Android,,"Samsung Galaxy S21 specs leak reveals plastic base model, 10X optical zoom for Ultra, more"
65,Android,[removed],Does the Samsung galaxy m21s work in the United Kingdom?
66,Android,[removed],Why do so many android phones have rounded corners - including the screen itself?
67,Android,,MKBHD's 2020 Blind Smartphone Camera test polls are now live!
68,Android,[removed],What's the fastest cigarette lighter charger out there ?
69,Android,[removed],Best Google Photos style solution for Home Server
70,Android,[removed],Latest update
71,Android,[removed],Airpods alternative for Android
72,Android,[removed],Mobile Baas
73,Android,[removed],Is there a way to spoof your location?
74,Android,,Snapchat will pay creators to post on Spotlight — it newly launched built in-app
75,Android,[removed],Any reccomends on voice changers? (Samsung galaxy s9)
76,Android,[removed],Is the spigen ultra hybrid good?
77,Android,[removed],How do the various manufactuers notify you when your older device is no longer being supported?
78,Android,[removed],Issues while Video/Streaming on MiBox
79,Android,[removed],HI guys
80,Android,,Google's Phone app might be rebranded to 'Google Call' - 9to5Google
81,Android,,"""Google’s latest AR app brings the Mandalorian to your living room"" - but you need a 5G phone?? I mean what does 5G have to do with AR core?"
82,Android,[removed],How can I stop getting texts in a group chat I am in on my samsung J3?
83,Android,[removed],Free apps to block Instagram and Messenger notifications?
84,Android,[removed],"[DISCUSSION] In 2020, is it still a viable strategy to buy a phone with the intention to unlock/root/custom ROM when official software support ends? Especially if you want to keep using banking apps, Netflix, etc.?"
85,Android,[removed],Back Up Photos
86,Android,[removed],"Apps, programs, and services for downloading the latest versions of apps from Google Play for different smartphone architectures."
87,Android,[removed],samsung galaxy j3 v use sd card internal storage
88,Android,[removed],How can i transfer my text messages to my pc?(for free)
89,Android,[removed],I need help about my pin code on my phone
90,Android,[removed],"Have issues with Android Drivers installation, then try my tool"
91,Android,[removed],What does change app aspect ratio option do in the task manager? [S10]
92,Android,,gameplay
93,Android,,Amazing Sheriff - #1 Best Android Adventure Game - Orc Games
94,Android,[removed],Bubbles are a hot dumpster fire - why??
95,Android,,My app (DeineTierwelt) is nominated for the google play awards and i need your votes (german playstore only)
96,Android,[removed],Did something recently happen with the YouTube app?
97,Android,[removed],Complete BLACK themes for Google apps
98,Android,[removed],What to do with old Phone ?
99,Android,"Note 1. Join us at /r/MoronicMondayAndroid, a sub serving as a repository for our retired weekly threads. Just pick any thread and Ctrl-F your way to wisdom! 

Note 2. Join our IRC, and Telegram chat-rooms! [Please see our wiki for instructions.](https://www.reddit.com/r/Android/wiki/index#wiki_.2Fr.2Fandroid_chat_rooms)",Moronic Monday (Nov 23 2020) - Your weekly questions thread!
0,Android,[removed],How do you remove sound and brightness on the left and right side in Samsung video player.
1,Android,[removed],"Galaxy S10 Lite Screen died, need help getting the data"
2,Android,[removed],Cash2Phone- Sell Old Mobile Phone Online For Best Price
3,Android,[removed],Disable Touch
4,Android,,Download Period Tracker Clue – Ovulation and Cycle Calendar .APK
5,Android,,"Vivo V20 Price, Overview &amp; Full Specifications"
6,Android,[removed],Is this a OnePlus or Android issue? Whatsapp &amp; Instagram
7,Android,[removed],Unihertz Jelly 2 is being Shipped!
8,Android,,Recover My Files Crack + License Key Download [2021]
9,Android,[removed],How can I create files that can be read and written by two different apps (without an SD card)?
10,Android,[removed],Image to PDF Converter
11,Android,[removed],Random SMS wipes?
12,Android,[removed],Can't Grant Accessibility Services permission
13,Android,[removed],Snapchat doesn't refresh itself (which may be the case for a lot of others)
14,Android,,Recover My Files Crack + License Key Download [2021]
15,Android,,dvdvdv
16,Android,[removed],Google task mate referral code
