,subreddit,selftext,title
61,Android,[removed],A tribute to an 11 year old classic - pizzicato.ogg
62,Android,,More Samsung Galaxy S21+ hands on pictures
63,Android,[removed],Phone randomly called phone carrier...
64,Android,,Apple iPhone Devices Sweep 9 of Top 10 Devices on Christmas 2020 (USA)
65,Android,[removed],Android 11
66,Android,[removed],"Samsung makes a first-party app to increase the number of volume steps so the jumps are smaller. Had been annoying me, so I thought I'd post in case anyone else was wayyy behind like me"
67,Android,[removed],CMV: Android is malware OS created by Google to push their services.
68,Android,[removed],Is epic games Apk safe
69,Android,[removed],Looking to ditch my iPod. What is the best music app for Android so that I can bring my music files with me on my phone?
70,Android,[removed],Is there an alternative to the Marco Polo video voicemail app?
71,Android,[removed],Smartphones with LED notification
72,Android,[removed],"Can't find this Notes App, Samsung S10 (Pic attached)"
73,Android,[removed],What can Samsung’s One UI do that the Pixel or other Android versions can’t?
74,Android,[deleted],How to downgrade apk?
75,Android,,Vivo X60 and X60 Pro announced with 5nm Exynos 1080 chipsets
76,Android,[removed],i am looking for a good custom rom for my xiaomi redmi 7
77,Android,[removed],Turn old android phone into a usb button pad.
78,Android,[removed],Chat bubbles
79,Android,[removed],Instagram quality on Android
80,Android,[removed],Need help with Android Tablet GPS
81,Android,[removed],How to effectively delete all files and physcially destroy an android phone?
82,Android,[removed],Is 5g really necessary?
83,Android,,"Next year, every company — especially Google — needs to embrace big phone sensors | Android Central"
84,Android,[removed],UNLOCK HELP: How can i unlock my deceased brother's OnePlus 6 phone?
85,Android,[removed],Should I get the iPhone 12 mini or oneplus 8t cyberpunk edition or the mi 10t Pro. What other alternatives?
86,Android,,Vivo X60 and X60 Pro announced with 5nm Exynos 1080 chipsets
87,Android,[removed],Is android mobile voice chat support with random strangers available for among us?
88,Android,[removed],Question regrading Android OS upgrade
89,Android,,Download Cx File Explorer .APK
90,Android,,Is it me or the S21+ look stunning
91,Android,[removed],Is it me or Contextual Suggestions are getting better ?
92,Android,,Vivo X60 confirmed to come with Samsung Exynos 1080 chipset
93,Android,[removed],IPHONE EMOJIS ON ANDROID. HOW.
94,Android,,"Sony Xperia 1 III alleged specs and price leaked: 5G smartphone with Snapdragon 888 and 6.5-inch 4K OLED for US$1,199"
95,Android,,"I will not give up using Samsung phones because of poor cameras or wide bezels. These problems have occurred and I have accepted them. But I can't tolerate One UI becoming garbage, if it continues to fail, I will give up using Samsung phones as the main phone."
96,Android,[removed],How do I use a Bluetooth trackpad/keyboard present in android 10 phone to control an android 8 tablet?
97,Android,,Xiaomi's Mi 11 Launches as the World's First-Ever Snapdragon 888 Phone
98,Android,[removed],General question: Why is Android not updated like Linux (or pcs in general)?
99,Android,,Samsung Readies itself for Pre order in US. Are these leaks true?
0,Android,,YOU ARE BROKE - New Year 2021 Motivational Speech Jim Rohn - Ed Mylett
1,Android,,YOU ARE BROKE - New Year 2021 Motivational Speech Jim Rohn - Ed Mylett
2,Android,,It is time to learn kotlin (tuto in french)!
3,Android,,Microsoft acquires Sony.
4,Android,[removed],Is snapchat or WhatsApp optimized with any android flagships?
5,Android,[removed],"My first game, I hope everyone will support and give suggestions, pandemic trend"
6,Android,,A lovely child is trying to play robbot game.(1920*1080)
7,Android,,ASUS starts rolling out the Android 11 stable update to the ZenFone 6 in Taiwan
8,Android,,How To Set Any Video Wallpaper (Home + Lockscreen) Of Your Choice (Free App)
9,Android,,Xiaomi Mi 11 launch event
10,Android,,Xiaomi Mi 11 Series LIVE Launch Date
11,Android,[removed],Tech support - apps act as if internet is super slow
12,Android,[removed],AirPods Pro quiet on LG Velvet
13,Android,[removed],Coming back to android
14,Android,[removed],Psa: BE CAREFUL WHEN INSTALLING THE NEW UPDATE!
15,Android,[removed],"r/android users, how many of you still have another apple device?And if so,which?"
16,Android,[removed],[Question] Will Newer Back-ups Overwrite Older Back-ups in Google Drive?
17,Android,[removed],Great mobile game Mech Arena
18,Android,[removed],Question about Root
19,Android,[removed],SAMSUNG A51 BATTERY
20,Android,[removed],SAMSUNG A51
21,Android,,Download Document Scanner – PDF Creator .APK
22,Android,[removed],So I work in a factory and use a phone to communicate with other coordinators. Is there a device that can be linked to the phone so I don't miss messages?
23,Android,[removed],macos/ipadOS launcher? #question
24,Android,[removed],Exploring my options
25,Android,[removed],Help! My android phone will not charge with any charger or wall brick
26,Android,[removed],How many of you will hold on to your phones for 1 year or more?
27,Android,[removed],App icon?
28,Android,,"Enpass introduces new Premium features, irking Pro users who already paid"
29,Android,[removed],Samsung Note 8 SM-N950U Firmware Options
30,Android,[removed],How do I buy music in Canada now?
31,Android,[removed],"[Help] OneUI 3.0, SD card inserted persistent notification"
32,Android,[removed],Is there a way to remap bluetooth controls?
33,Android,[removed],"I tested the iPhone 12 Pro Max against the 11 Pro, Pixel 4a, and Pixel 4XL in extreme low light conditions. Here's what I learned."
34,Android,[removed],Tablet suggestions for a light media usage
35,Android,,"LG G8X Thinq Dual Screen for $399, Galaxy Note 20 5G for $843, Pixel 4a 5g for $459, iPhone XR for $364 and more discounts"
36,Android,[removed],How do I disable my headphones from pausing videos.
37,Android,,This charger is pretty cool!
38,Android,[removed],Android 11 for the One Macro
39,Android,[removed],Is the LG Velvet a girl phone?
40,Android,,"Someone sold a OnePlus 9 5G on eBay for $6,000"
41,Android,[removed],What do you think about Xiaomi charging customers the same price for the phone with and without a charger in the box?
42,Android,[removed],Christmas automatic update broke my Huawei P10... what to do?
43,Android,[removed],Good software to manage tablets remotely?
44,Android,[removed],Best non flagship android phone
45,Android,[removed],Background app notifications
46,Android,[removed],S20 FE vs s20 plus
47,Android,[removed],"What's the difference between Freezing, Disabling and Hibernating"
48,Android,[removed],Is it possible to get 70fps in a 60 hz screen???
49,Android,,2020 Winners and Losers: OnePlus | GSMArena
50,Android,,Iherb discount coupon Copy the coupon CNO2398
51,Android,,Polkadot targets $6 after Binance replaces ETH with DOT on homepage
52,Android,,Under 25 k best mobile 2020 Samsung
53,Android,[removed],What 'next gen' features are you looking for on your next upgrade?
54,Android,[removed],"Why is everyone ditching chargers in their boxes and moreover, how are people at large/ regulating authorities fine with this?"
55,Android,[removed],alarm turned on at 7am. i never set one up.
56,Android,,"SPEED TEST: Chrome, Edge, Firefox, Opera, Samsung, and more!"
57,Android,[removed],"Copy-paste post since I'm lazy, but-GrapheneOS is being sued by a company that has been harassing GrapheneOS for a while"
58,Android,,Toggle Button With Image Vector Image Android Studio
59,Android,,Finally an app which uses COMPLETE ENCRYPTION (not just End-to-End)
60,Android,,Download Space Armada: Galaxy Wars .APK
61,Android,,Xiaomi launches the Mi 11 flagship 5G phone with Qualcomm’s Snapdragon 888
62,Android,,Xiaomi launches the Mi 11 flagship 5G phone with Qualcomm’s Snapdragon 888
63,Android,,Xiaomi Mi 11 announced: The first Snapdragon 888 phone packs sub-$650 price (in china)
64,Android,,AnandTech Year In Review 2020: Flagship Mobile
65,Android,,Xiaomi launches the Mi 11 flagship: Snapdragon 888-powered phone with a QHD+ display for just over US$600
66,Android,,Samsung Galaxy S22 selfie-camera might work like thisEyes https://nl.letsgodigital.org/smartphones/samsung-galaxy-s22-camera/ Revolutionary punch-hole camera which is invisible when the front-camera is not in use thanks to a mechanically moving sub display.
67,Android,[removed],Is it possible to get store loyality cards on Google pay screen?
68,Android,[removed],"How can I hear the ringtone when someone calls me during ""do not disturb"" mode?"
69,Android,[removed],No emojis in system
70,Android,"Note 1. Join us at /r/MoronicMondayAndroid, a sub serving as a repository for our retired weekly threads. Just pick any thread and Ctrl-F your way to wisdom! 

Note 2. Join our IRC, and Telegram chat-rooms! [Please see our wiki for instructions.](https://www.reddit.com/r/Android/wiki/index#wiki_.2Fr.2Fandroid_chat_rooms)",Moronic Monday (Dec 28 2020) - Your weekly questions thread!
71,Android,,"Meet the Fairphone 3+, thought I'd share this video with you guys"
72,Android,[removed],Android 11 za Xperia XZ3
73,Android,[removed],Is there a way to set a reminder for every 4 hours
74,Android,[removed],Shoud I root my Samsung galaxy note 10 phone?
75,Android,[removed],So no more updates for moto g7?
76,Android,,Pre-order reservations in the U.S. for the Galaxy S21 series are open
77,Android,[removed],Think I should get a case with my Rog phone 3?
78,Android,[removed],How to turn down phone call speaker volume below minimum?
79,Android,[removed],"Google Opinion Rewards says that ""Part of your balance will expire on ..."" But what part?"
80,Android,,Darka - Ultra HD Dark Backgrounds
81,Android,[removed],Google Services in AOSP GSI
82,Android,[removed],I'm trying to make an Android Auto app for fun and there is not System Image for Virtual Device
83,Android,[removed],How/where to get phone insurance for my phone
84,Android,[removed],"Do any reliable durable, fast USB -C chargers actually exist?"
85,Android,[removed],PayTM Mini App store vs Google App Store
86,Android,,Onyx Boox Note Air review: A full-blown E Ink tablet with a major flaw
87,Android,[removed],"1080p displays are objectively better than 1440p for performance &amp; battery life, so why are we acting like any phone switching from 1440p to 1080p is a ""downgrade"" in terms of user experience?"
88,Android,[removed],Can anyone suggest a phone?
89,Android,[removed],What happened to Evie launcher?
90,Android,[removed],Question about the A20
91,Android,[removed],"How many of you also use apple products?If so, which?"
92,Android,,Download Battle of Warships: Naval Blitz .APK
93,Android,[removed],I'm surprised there is no application that is able to record your voice and the audio from the Phone call you're having
94,Android,[removed],Link sharing
95,Android,[removed],Is there a SMS alarm app that can fire an alarm when a certain msg comes in???
96,Android,[removed],Hello r/Android. I'm looking for upgrade advice
97,Android,[removed],Need help with Google Pixel 5 for elderly father
98,Android,[removed],What's your guys' favorite smartphone of all time and why? Mine is the Samsung Galaxy S4 and you'll see why down below
99,Android,[removed],Is it good to update apps on older Android past a certain point?
0,Android,[removed],Help!
1,Android,[removed],Where to go from a Moto Z Play?
2,Android,[removed],My ANDROID phone screen is broken. It has important google authenticator accounts and the backup codes have been lost. I know how to download the rom to My PC but is there any way of running the rom in windows to get more authenticato backups?
3,Android,[removed],"Screen broken, touch works, need to screen mirror"
4,Android,[removed],How to get the weather temp show in home and lock screen on google pixel 4a and 4a 5g? My weather temp keeps disappear out of nowhere.
5,Android,[removed],Huawei p10- Do Google apps work?
6,Android,[removed],how long will Samsung Note 10+ get updates
7,Android,[removed],I receive request failed message from the receiver help ?
8,Android,[removed],How to block ads for chrome?
9,Android,[removed],"Looking for a way to toggle a smart light on and off (lifx) with bixby button, or some other way without unlocking my phone."
10,Android,[removed],Top 20 gfxtools apps for android
11,Android,[removed],Anyone else not having YouTube update it's watch history?
12,Android,[removed],Smart replies won't work for me?
13,Android,,OFFLINE GAMES MOBILE
14,Android,,How to use virtual background in Zoom for Linux Ubuntu 18.4?
15,Android,[removed],Is it possible to save reddit videos directly from the app?
16,Android,[removed],Software update slowed down my phone
17,Android,[removed],Android box with google play store
18,Android,[removed],How to disable only some sensors?
19,Android,[removed],What is a flagship anymore?
20,Android,[deleted],"10 new Android games from the last week: The best, worst, and everything in between (12/21/20 - 12/27/20) - RokzFast"
21,Android,[removed],Anyone has notification issues with the latest Telegram update?
22,Android,[removed],Assistant now able to sync with Keep and other services.
23,Android,,7 smartphone trends that really should stop in 2021
24,Android,[removed],Switching from iPhone to Samsung but still keeping macbook or ipad?
25,Android,[removed],How do you feel about Google Pixel 4a?
26,Android,,"Xiaomi Mi 11 success practically guaranteed after over 226,000 people sign up for preorders"
27,Android,[removed],Can anyone tell me how to use my android phone to sign in to my Gmail on a pc?
28,Android,[removed],Video volume is too low during calls
29,Android,[removed],Run small apps from master app like MPL Pro/HAGO
30,Android,,A New Year’s Resolution for OEMs: Please fix your smartphone branding
31,Android,[removed],"If I go to Google Play Store and ""uninstall"" Google Play Music to remove updates will it remain functional?"
32,Android,[removed],Android notification hub widget
33,Android,"Note 1. Join our IRC, and Telegram chat-rooms! [Please see our wiki for instructions.](https://www.reddit.com/r/Android/wiki/index#wiki_.2Fr.2Fandroid_chat_rooms)

This weekly Sunday thread is for you to let off some steam and speak out about whatever complaint you might have about:  

* Your device.  

* Your carrier.  

* Your device's manufacturer.  

* An app  

* Any other company

***  

**Rules**  

1) Please do not target any individuals or try to name/shame any individual. If you hate Google/Samsung/HTC etc. for one thing that is fine, but do not be rude to an individual app developer.

2) If you have a suggestion to solve another user's issue, please leave a comment but be sure it's constructive! We do not want any flame-wars.  

3) Be respectful of other's opinions. Even if you feel that somebody is ""wrong"" you don't have to go out of your way to prove them wrong. Disagree politely, and move on.",Sunday Rant/Rage (Dec 27 2020) - Your weekly complaint thread!
34,Android,[removed],How to Enable Game Driver Preferences on Huawei developer options?
35,Android,,"League of Legends Wild Rift Minimum System Requirements, Tried and Tested - TechPinas"
36,Android,[removed],What are my choices now?
37,Android,,"Apple or Android phones, which has a better advantage in African environment?."
38,Android,[removed],FRP bypass
39,Android,[removed],Mobile data broken after updating S20 FE
40,Android,,"Best phone for low light conditions? I had few flagships recently. OnePlus 8pro , S20, and Huawei p40 pro is way ahead if you talking about photography/videography"
41,Android,,Samsung Galaxy S21 and S21 Plus: All details about the new smartphones
42,Android,[removed],Zoom disconnecting my buds... but lm still connected?
43,Android,[removed],Will 65w charging massively degrade phone battery over a short period of time?
44,Android,[removed],Need a phone upgrade
45,Android,[removed],Notifications Creep Up at Boot - Need Your Help
46,Android,[removed],SMS Emergency Bypass in DND Mode
47,Android,[removed],Any way I can make my 64gb sd part of internal storage?
48,Android,[removed],Can a guest user hack my device
49,Android,[removed],Android pc manager.?
50,Android,[removed],Weird Behavior with Riru/EdXposed/Magisk
51,Android,[removed],How to disable dynamics shortcuts in WhatsApp?
52,Android,,Galaxy S21and S21+ will have an Exynios CPU outside the US.
53,Android,,A charger for the Mi11 will reportedly be provided upon request
54,Android,[removed],Is there an Android device that doesn't take a SIM?
55,Android,[removed],Burning question???
56,Android,[removed],Here is my top 3 list of the best android customization channels in telegram. Hope you like them
57,Android,[removed],Games aren't working Android 11
58,Android,[removed],ProTip: In the YouTube app you can swipe up on the video to go full screen.
59,Android,[removed],Should I root?
60,Android,[removed],Question from Android n00b
61,Android,[removed],Cheap android phone that charges fast
62,Android,[removed],Is there any way to change the icons on my phone without changing the entire layout of my phone?
63,Android,[removed],Do Mobile Signal Booster Antennas actually work?
64,Android,,T-Mobile got caught overpromising how good their 5G network is - TalkAndroid.com
65,Android,[removed],Android Youtube picture-in-picture bug.
66,Android,[removed],Phone making phantom call noises
67,Android,[removed],black screen SM J5 NEO
68,Android,[removed],"Long term IOS user looking to switch to android for a few reasons, and just have a few questions."
69,Android,[removed],Help me win a Huawei Watch Fit
70,Android,[removed],Ordered a FitBit Versa 3... Got gifted a LG Watch Sports (2017).
71,Android,[removed],Messenger on Android 11 - Can I switch back to chat heads?
72,Android,[removed],Help me pick a phone please!
73,Android,[removed],Hey how important *really* is it to have a phone with the latest security updates?
74,Android,[removed],Best app for blocking adds?
75,Android,[removed],"If Android companies like to copy Apple, why don't they add 5 years of software support?"
76,Android,[removed],Media controls
77,Android,[removed],Accessibility swipe up issue since last update ?
78,Android,[removed],"Audio playing issue, priority"
79,Android,[removed],Best Android on the market with a headphone jack?
80,Android,[removed],How to get Hotmail to play nice?
81,Android,[removed],My Blu Vivo X6 Gestures Keeps Resetting
82,Android,[removed],Question on google contacts!
83,Android,,Samsung fails to ship 300 million units for the first time in 9 years
84,Android,,Mobile phone under 10000
85,Android,,"Exynos processor, does it accept Android 11 update?"
86,Android,[removed],"Need help, Pixel 5, Samsung S20 5g, Samsung S20 FE or Oneplus 8T?"
87,Android,[removed],Is it possible to sync texts on two phones?
88,Android,[removed],Apple ecosystem alternatives for android.
89,Android,,"Yes, Xiaomi cancelled the charger in the box. But Xiaomi and Apple treat consumers in completely different ways. I will keep it secret first, and wait for the Xiaomi conference to let the CEO tell us."
90,Android,[removed],Why is Bluetooth audio bad on Android?
91,Android,[removed],How can I use the amazing miui 10 camera on a redmi note 8 but with a custom ROM?
92,Android,[removed],"DS4 regognized as ""Generic X-box pad"""
93,Android,[removed],Android app help for rewards cards
94,Android,,Xiaomi CEO confirms Mi 11 retail box will not come with a charger
95,Android,[removed],My phone is in a bootloop state and cannot acces safe mode.
96,Android,,Download Crunchyroll .APK
97,Android,[removed],Countdown widget that shows only the next item?
98,Android,[removed],If you are interested in Smart Tech!
99,Android,[removed],An easier/more beautiful access to media control and Google search and Android TV remote?
0,Android,[removed],android 11 chat bubble troubles
1,Android,"Note 1. [Check out our apps wiki](https://www.reddit.com/r/Android/wiki/index#wiki_apps) for previous threads and apps curated by the reddit Android community!  

[Download the official /r/Android App Store based on our wiki!](https://github.com/d4rken/reddit-android-appstore/releases)

Note 2. Join us at **/r/MoronicMondayAndroid**, a sub serving as a repository for our retired weekly threads. Just pick any thread and Ctrl-F your way to wisdom! 

Note 2. Join our IRC, and Telegram chat-rooms! [Please see our wiki for instructions.](https://www.reddit.com/r/Android/wiki/index#wiki_.2Fr.2Fandroid_chat_rooms)


***  

This weekly Saturday thread is for:  
* App promotion,  
* App praise/sharing  

***  

**Rules:**  

1) If you are a developer, you may promote your own app ONLY under the bolded, distinguished moderator comment. Users: if you think someone is trying to bypass this rule by promoting their app in the general thread, click the report button so we can take a look!",Saturday APPreciation (Dec 26 2020) - Your weekly app recommendation/request thread!
2,Android,,Best Boxing Day Tablet Deals UK 2020
3,Android,[removed],Is miui as smooth as oxygen os in the long run?
4,Android,[removed],Is Rooting safe for an Android phone or not?
5,Android,,What is Fastboot mode and how to get exit form it in Android(Mi mobiles)?
6,Android,[removed],Why does Bluetooth audio sound bad on Android?
7,Android,[removed],Help with Music on Motorola Edge
8,Android,,Hog + Miner
9,Android,[removed],"3,5mm jack vs HDMI battery consumption for listening to music?"
10,Android,[removed],Need tech support for google play store - customer support is sending me in circles - can anyone point me in the right direction?
11,Android,[removed],"If you often search on web, you are going to love Lookup"
12,Android,[removed],How to turn on an android phone without a power button?
13,Android,[removed],How do you get the gps coordinates of an image you take?
14,Android,[removed],Messages disappeared for 1 person (iPhone user)
15,Android,[removed],My top 3 list of the best android customization channels in telegram!!
16,Android,[removed],Dual slot car charger that support Warp charging or fast charging
17,Android,[removed],Why is my keyboard covering up my Instagram text when I edit the photo description?
18,Android,[removed],Help an iPhone user switch over
19,Android,[removed],What do you guys think about this video?
20,Android,,How to Open and Read a PDF on Android
21,Android,,Here's a prototype of the OnePlus 9 5G. These images come from an eBay seller/listing that seems to be the same source that gave live images to @PhoneArena recently.
22,Android,[removed],LG G7 Thinq - Cant determine what's taking up space in my files folder in internal storage
23,Android,,Android’s Fast Pair UI for setting up headphones updated to look like iOS
24,Android,,Download Design Home: House Makeover .APK
25,Android,[removed],SIM Card Tray
26,Android,[removed],Volume button app recommendations?
27,Android,[removed],How do I uninstall/delete a module from NiceLock
28,Android,[removed],Upgrade to Android 11 has caused a big performance hit in certain games
29,Android,[removed],Can I use USB C on PD port?
30,Android,[removed],Webcam as phone camera
31,Android,[removed],Worth upgrading from LG G7 Thinq to Samsung Galaxy A71?
32,Android,[removed],My sister thinks her phone is tapped
33,Android,[removed],Does anyone knows a good IOS emulator for android?? 🙏🙏
34,Android,[removed],Looking for a secure folder app with photo tagging option
35,Android,,Oppo X Tom Ford slider concept
36,Android,[removed],"Why some device lag but another devices, same models, don't"
37,Android,[removed],"I'm trying to cast my screen to my roku, but all I can find is a cast menu, and it cant find the roku. Every guide I have looked at tells me to go to a menu in this cast section and select ""enable wireless display"" but there is no such menu in my cast section. What can I do? Any help appreciated."
38,Android,[removed],Hey guys what android should I get if I really don’t care about the camera just the specs? :)
39,Android,[removed],Family link app sharing question
40,Android,[removed],Airport Pros on Android?
41,Android,[removed],OnlyFans Hack - How to Get OnlyFans Premium (iOs &amp; Android)
42,Android,[removed],DS4 R-Stick Drift on Android only
43,Android,,"T-Mobile is shutting down service to these phones, but will offer free replacements"
44,Android,,Amazfit GTS Smartwatch Review: Almost A Perfect Watch
45,Android,[removed],Maybe a noob question
46,Android,[removed],Is there a way to backup full apps?
47,Android,,The turing game: a very simple yet challenging puzzle game that will keep you entertained and intrigued for hours! It's completely free and with no ads or in game payment. Play it now for free!
48,Android,[removed],Is anyone else having terrible disabling notifications for a conversation in the official Messages app?
49,Android,[removed],how do I open recovery mode on the Sony xperia V
50,Android,[removed],Does having a bigger phone mean worse screen quality on youtube etc.
51,Android,[removed],"Is there a music player capable of changing its color palette based off cover art, similar to the notifications on GPM?"
52,Android,[removed],Simple Gallery Pro is currently free
53,Android,[removed],Battery charging limit
54,Android,[removed],Google play crashes when purchasing and in-app purchasing make app crash
55,Android,[removed],Replacing old S10 with smaller device
56,Android,[removed],Rooting a Revvl 5G.
57,Android,[removed],"Open source Simple Mobile Tools Pro versions, for free, today! Happy Holidays to everyone celebrating!"
58,Android,[removed],Swiping through posts on android like apple?
59,Android,[removed],Simple app to send notification / raise bell to another Android device
60,Android,[removed],My phone keeps deleting the music I transfer to my SD card and it's driving me nuts
