,subreddit,selftext,title
0,Android,,OnePlus broke Google Play on 7T Pro with latest update to 10.0.14. Don't upgrade!
1,Android,[removed],Blinking battery arrow
2,Android,[removed],I need help pls
3,Android,[removed],M31 Android 11
4,Android,[removed],Where are wallpapers saved to?
5,Android,[removed],iOS like live wallpapers
6,Android,[removed],Built-in call recording?
7,Android,,"Download piZap Photo Editor, MEME Maker, Design &amp; Collages .APK"
8,Android,[removed],S21ultra 256 back order
9,Android,,New Fossil Gen 5E Smartwatch
10,Android,[removed],Play console - Distinguish revenue
11,Android,[removed],Accu battery pro!!
12,Android,[removed],Google reinstated Element (Matrix chat app)
13,Android,[removed],Game Launcher won't let me play any games.
14,Android,,How to create a list in Dart
15,Android,[removed],Why doesn't Android let you area crop videos?
16,Android,[removed],How much ram do you guys use?
17,Android,[removed],FreeOTP/Google Authenticate &amp; Samsung Galaxy Note 20 Ultra &amp; Namecheap
18,Android,[removed],question
19,Android,[removed],Sky Sports Android App Has A Horrible Blue Bar During Live Events That Doesn't Go Away. Is There a Third Party Magnifying app or Something Similar I can use to as a Work-Around to Zoom in on the Screen I want to View? The Blue Bar on Top and Black Bars Either Side take up 30% of the Viewing!
20,Android,[removed],Help! Recently used emojis
21,Android,[removed],How to make notifications compact?
22,Android,,"Our first game, Season Smash, hope you like it. We would appreciate feedback :)"
23,Android,[removed],Issue with the 'auto smoothing' of pictures on the S21 Ultra
24,Android,[removed],Tried to root a Pixel 3a and got stuck in Fastboot Loop
25,Android,[removed],Am I blind? I can't find my auto rotate - Samsung Note 10+
26,Android,[removed],"how to stop android phone from asking me to allow ""casting or recording with your phone companion"" when I use Microsoft Your Phone on windows 10 ?"
27,Android,[removed],Watch all world channels just at 0.1 Euro per day.
28,Android,[removed],"Android GPS secret tracking app, invisible and free, post here please."
29,Android,[removed],Galaxy s10+ Playing Random Show With No App Open
30,Android,[removed],NEED HELP! PROBLEM WITH MY NEW POCO X3
31,Android,[removed],This would be my dream phone. What is the closest to it?
32,Android,[removed],Can I jump from android One 10 ver. 10.0.10.0 to 10.0.17.0 via recovery mode update ?
33,Android,[removed],Wireless charger
34,Android,[removed],Google Play Store will soon let Android users download gambling apps
35,Android,[removed],Have returned to Android after 6 years on iOS. After some app recommendations that will run on a galaxy note 9.
36,Android,[removed],Touch screen responds inaccurately
37,Android,[removed],"Just a quick tip for anyone that has a Moto G9 Plus/Power, and doesnt like Gesture Control: The old style 3 button controls are in Settings under System Navigation."
38,Android,[removed],"Annoying ""Copying images..."" Notification"
39,Android,[removed],Disable Accessibility!!! Fixes the Kishi (or other gamepads/Bluetooth controllers) not working on Android 11 issue!!!
40,Android,[removed],Please help me find a file from a xda site
41,Android,[removed],Please help me fiind a file from a xda site
42,Android,[removed],ThermGo: The Most Portable Thermometer For Mobile Devices
43,Android,,Anyone wanna try my android game 🥺 would help me alot
44,Android,,Download Dragon’s Lair .APK
45,Android,[removed],i have a karbonn a1 that i forgot the google account used on it and now cant use the phone at all. can someone help me with this?
46,Android,,Unofficial Windows/Linux Galaxy Buds Client
47,Android,[removed],Emojis on galaxy s21
48,Android,[removed],How to Unlock Bootloader on Nokia 7.1
49,Android,[removed],Cant achieve 25w wired or 15 wireless charge on S21
50,Android,[removed],Can you access samsung galaxy j6 content without lock screen ? My phone was stolen
51,Android,,Global Privacy Control (GPC) Enabled by Default in DuckDuckGo Apps &amp; Extensions
52,Android,,"Task Changer update could be in March, EdgeLighting+ update in 2nd half of 2021, &amp; new module news"
53,Android,,"Is the Galaxy S21 Ultra using AI to fake detailed Moon photos? ""I never expected to go this deep down the rabbit hole. With so many conspiracy theories surrounding the Galaxy S21's 100x zoom, I found myself taking on the most unexpected investigation of my tech reviewing career"""
54,Android,[deleted],"Task Changer update could be in March, EdgeLighting+ update in 2nd half of 2021, &amp; new module news"
55,Android,,"Task Changer update could be in March, EdgeLighting+ update in 2nd half of 2021, &amp; new Goodlock module news"
56,Android,,Xiaomi Privacy Policy Update
57,Android,[deleted],How to (maybe) bypass SafetyNet hardware attestation on devices with an unlocked bootloader
58,Android,,"TROYPOINT 300,000 Mega Giveaway"
59,Android,[removed],Apps that can replace the Google search bar on Quickstep launcher
60,Android,[removed],Oneplus not reading my SIM all of a sudden
61,Android,,"Finally managed to create my own, patched version of Gboard, enabling you to costomize the layout as you wish (used it to remove the . button from the bottom bar)"
62,Android,,Tempi di ricarica Galaxy S21 Ultra 5G
63,Android,[removed],Recording Phone Calls?
64,Android,[removed],"Samsung promised full camera support in social media apps like Snapchat and Instagram in the new S21 series. Now that some of you have the new S21 series, have you tried this out? Is it any better?"
65,Android,[removed],Permanent moisture detected issue after updating to oneUI3 and Android 11 - Note 10+
66,Android,,New Motorola smartphone
67,Android,,How To Find What Google Knows About You and Limit the Data Google Collects From You.
68,Android,,Xiaomi Sues U.S. Seeking to Reverse Investment Ban
69,Android,,Best Quotes With Images and Texts
70,Android,[removed],Win the ipone x (Email Submit).
71,Android,,"The Truth about Xiaomi ""Air Charging"""
72,Android,,Xiaomi sets February 8th as the Mi 11 and MIUI 12.5 global launch date
73,Android,,The ROG Phone 5 could have a dot matrix on the back for Aura Lighting
74,Android,,Rog phone 5 leaked video shows secondary display at the back of the phone. Might be useful for notifications.
75,Android,,I'm making an rpg/rts crossover game for android and ios.
76,Android,[removed],powerpack
77,Android,[removed],turbohub
78,Android,[removed],Looking for an app
79,Android,,Phone capacitor testing || capacitor testing process 🔥🔥🔥
80,Android,[removed],"So i can't find one of my folders. I type the name of it in the search bar, nothing comes up, but when i try to create a folder with the same name it detects it."
81,Android,,Xiaomi Unveils Mi Air Charge Wireless Charging Technology -That can charge your smartphone from a distance without any Cables or Stands
82,Android,[removed],Change mouse pointer on android?
83,Android,[removed],Stock Wallpaper Downloads
84,Android,,@dhh: Pretty wild that the budget Androids are shipping with web performance that's about 7 years behind the latest Apple chips. About an exact order of magnitude down from the A14. Or about 8x slower than the iPhone SE 2020.
85,Android,[removed],So one of my folders is missing. I can access it with an app but i cant edit them. I just changed the name and i cant find it anywhere.
86,Android,[removed],One UI update issues
87,Android,[removed],True story: How Google added salt to our wound by their Andorid call record policy
88,Android,[removed],Why many Chromium based browsers lack option to disable image loading?
89,Android,,Chrome for Android starts rolling out grid view and Tab Groups
90,Android,,Google has suspended Element (Matrix chat app) in the Play Store without notifying the devs
91,Android,,Moto G9 Power review
92,Android,,Moto G9 Power review
93,Android,[removed],iPhone cover
94,Android,,Download Warframe .APK
95,Android,[removed],OneNote for Android 5.0?
96,Android,[removed],"""app was built for an older version of android"" PLS HELP"
97,Android,[removed],"Random ""Wheel of Fortune"" sound effects coming from my phone with no associated apps installed and no open apps that have ads...???"
98,Android,,"Android 12: Features, Rumors And News"
99,Android,[removed],"S21 ultra selfie camera problem, need help fixing it"
0,Android,[removed],"Is the Snapdragon 870 considered a ""mid-range"" chip? It's on par with the 865+, even slightly better, but it's being referred to as a mid range?"
1,Android,,"Good Lock modules ClockFace, MultiStar, and Home Up gain One UI 3 support"
2,Android,,best use full apps i have ever use i think u should also check this out ..
3,Android,,Netflix is testing a sleep timer with select Android users
4,Android,,Pixel 5 Camera: Has Google FAILED to keep up?
5,Android,[removed],Download audio from app
6,Android,,Is Samsung's Galaxy S21 Ultra using AI to fake detailed Moon photos?
7,Android,,"Watch ""Pixel 5 Camera: Has Google FAILED to keep up?"" on YouTube"
8,Android,[removed],Help using a Mobile Hotspot without a SIM card
9,Android,,Pixel 5 Camera: Has Google FAILED to keep up?
10,Android,[removed],Best App for 24/7 remote access to a phone?
11,Android,[removed],Can't add Outlook web mail to home screen (S21)
12,Android,[removed],"Hi, my phone i just found a bunch of images that I can't see and it says is from 1969"
13,Android,,Watch this video very interesting
14,Android,[removed],System update releases
15,Android,,--__--
16,Android,[removed],Calling all S20FE 5G users
17,Android,[removed],Run windows 10 on android through virtual machine/emulation
18,Android,[removed],Big screen 5g phones
19,Android,[removed],Texting error: No Subject Message Size 1KB
20,Android,[removed],Total Novice Here: I'm looking for a the simplest flip phone available that will be able to connect to my car with Android Auto.
21,Android,[removed],What new features would you like to see for 'Chat Bubbles'?
22,Android,[removed],What are the best apps similar to the Health App in IOS
23,Android,,Samsung Cheating !? Exynos Snapdragon S21 Ultra is NOT as good as you think in Genshin Impact!
24,Android,,Productivity app @clubhouse is getting loads of negative playstore reviews (2.6 rated now) because over-hyped audio based social media app @joinClubhouse carries the same name and doesn't have an android app!
25,Android,[removed],Sprint is fucking garbage
26,Android,,Learn Flutter By Build Onboarding Screen
27,Android,[removed],Smart switch is awful
28,Android,[removed],Android needs a optimization update
29,Android,[removed],Would like to know the opinions of anyone with android from 2018 or later.
30,Android,,Is Samsung's Galaxy S21 Ultra using AI to fake detailed Moon photos?
31,Android,,World best powerpack ZMI NO-20 UP TO 52%OFF AND FREE SHIPPING HURRY UP OFFER IS LIMITED PLEASE CLICK THE LINK
32,Android,[removed],Hey guys! Camera/Gallery F.A.Q
33,Android,,HotDive: Turn your phone into a smart diving gear
34,Android,,Download Calculator Plus Free .APK
35,Android,[removed],Where can I buy a US unlocked HTC U12+?
36,Android,,ZMI No. 20: The World's Most Powerful PowerPack 25000mAh Battery w/ 3 PD Ports | Revolutionary 210W Max Output | 100W USB-C/USB-A | Fast Charge
37,Android,[removed],ZMI No. 20: The World's Most Powerful PowerPack
38,Android,,Samsung's One UI 3.1 adds Google Home device controls to quick settings
39,Android,[removed],Do any screen protectors truly work with Galaxy fingerprint sensor?
40,Android,,Is Germany Safe? All Explorers Require to Know
41,Android,,Xiaomi Mi 11 is finally headed for global launch on February 8
42,Android,,Samsung says auto chip shortage could hit smartphones
43,Android,[removed],What do you think about the MediaTek Dimensity 1200? Is it good enough for gaming purposes?
44,Android,[removed],Can't wait for new phone
45,Android,[removed],Get $200 Amazon gift card free expansive offer.
46,Android,[removed],How to install Whatsapp in VirtualXposed?
47,Android,[removed],How come android tablet and phone users don't have the open with option when using a file manager?
48,Android,[removed],Pregnancy Game
49,Android,,Motorola demos wireless charging that can power devices 100cm away
50,Android,[removed],Given the option to switch my honor 8x for a OnePlus 5t. Should I take it?
51,Android,[removed],Wipe off data from a lost SD card
52,Android,,Top Best Smartphones For Elderly In 2021
53,Android,,Pubg mobile android game play 2021
54,Android,[removed],"Bedtime Mode still allows sounds, Android 10"
55,Android,[removed],Android 11 is the worst and buggiest android I've ever seen (Note 10+)
56,Android,,Royal Carving Furniture
57,Android,[removed],[rant] All I want is a flagship phone without a hole punch
58,Android,[removed],$500 Amazon gift card free expansive offer.
59,Android,,"Xiaomi introduces Mi Air Charge, wireless charging from across the room"
60,Android,[removed],"Lost my S9 that is locked with a pin, is it possible for it to be broken into or hacked by the person who found it?"
61,Android,[removed],Batch Background Changer
62,Android,,Xiaomi is making remote wireless charging a reality with 'Air Charge' tech.
63,Android,[removed],How to add a Lyrics to a downloaded song? mp3
64,Android,[removed],I want a better typing experience.
65,Android,,Samsung Galaxy S21 Ultra Review check it out.
66,Android,[removed],Top Mobile App Development Company
67,Android,[removed],Document Scanner
68,Android,,Download DigiCal Calendar Agenda .APK
69,Android,[removed],YouTube latest update: Clips
70,Android,[removed],prevent recorded videos from playing upside down after uploading
71,Android,[removed],Old phones risky?
72,Android,,Xiaomi announces Mi Air Charge Technology
73,Android,[removed],Where did the stepped alarm go on Android?
74,Android,,The TRUE wireless charging. Nikola Tesla is proud.
75,Android,,"Google salvaged Robinhood’s one-star rating by deleting nearly 100,000 negative reviews"
76,Android,[removed],"Don't buy entry level Samsung tablets, they are massive pieces of crap."
77,Android,,Gambling apps are coming to Google’s Play Store in the US and 14 other countries
78,Android,[removed],Is there actually any alternative to Moto G phones for pure android at £200-ish
79,Android,[removed],Xperia - Answering Machine APK?
80,Android,[removed],How to download SMS messages via USB on an old moto X4?
81,Android,[removed],"Back again, still looking for an Android phone"
82,Android,[removed],Cat S61 keeps locking itself
83,Android,,Google is deleting Robinhood reviews
84,Android,[removed],S21 Ultra Arrived a day early (UK)
85,Android,[removed],[Android 11] Tutorial - How to hide the navigation bar.
86,Android,[removed],The best
87,Android,[removed],Sending video between phones without loss?
88,Android,[removed],Unacceptable to you on a phone to you
89,Android,[removed],Things you find unacceptable on a phone?
90,Android,[removed],Things that are unacceptable to you on a phone?
91,Android,[removed],Received my S21 Ultra yesterday in the mail 2 days before launch
92,Android,[removed],Custom ROMs for not so well known models of Android phone.
93,Android,[removed],Only fingerprint shape on AOD with Samsung's Clock Face One UI 3 update
94,Android,[removed],How to update Android in a smartwatch
95,Android,,Multistar module for GoodLock One UI 3 available to sideload
96,Android,[removed],Why is my phone have less sound quality when listening to music than when a listen to music during a call via Discord?
97,Android,[removed],Rooting Huawei p20lite
98,Android,[removed],Downloaded gifs don't play in gallery
99,Android,[removed],"Spotify doesn't pause playback when answering a Facebook Messenger call [Note 20 Ultra, Android 11]"
0,Android,,New Spotify Patent Involves Monitoring Users’ Speech to Recommend Music
1,Android,,From first to sixth: Huawei’s phone business tanks thanks to US sanctions
2,Android,,ZTE Axon 30 Pro 5G coming with an in-display camera
3,Android,[removed],Xperia XA2 auto connect problem
4,Android,[removed],No more Secure Startup?
5,Android,[removed],Is factory reseting after major software update worth it?
6,Android,,[Gift]WIN New iPhone XS MAX.
7,Android,[removed],Want an app to record phone audio
8,Android,,Is factory reseting after majuor ssoftware update worth it?
9,Android,,Download Block Puzzle Jewel .APK
10,Android,,THIS VIDEO WILL HACK YOUR DEVICE!!!
11,Android,,[Gift] WIN New iPhone XS MAX.
12,Android,,Fleeing WhatsApp for Better Privacy? Don't Turn to Telegram
13,Android,[removed],Note 10 plus won't let me change the wallpaper.
14,Android,[removed],Trying to separate existing files from previous versions.
15,Android,[removed],"Android 11's media bar changes suck / need help with ""hide player when media session has ended"" toggle"
16,Android,[removed],We are launching a sustainable habit-building app tomorrow - any advice on where to spread the word about it would be much appreciated! Thanks! :))
17,Android,,Galaxy S21 Teardown! - Its bigger than you think.... [JerryRigEverything]
18,Android,,"Exclusive first look at Sony's new Flagship, the Xperia 1 III"
19,Android,[removed],2 great free open source Reddit clients for Android
20,Android,[removed],My First Game
21,Android,[removed],how do I turn off swipe up for google assistant?
22,Android,,JerryRigEverything - Galaxy S21 Teardown
23,Android,[removed],YouTube Channel Shortcut on Home Screen?
24,Android,[removed],Why Sony mobiles not as popular as Samsung mobiles?
25,Android,[removed],Rooting galaxy s10 snapdragon
26,Android,[removed],[Discussion] We need to talk about One UI 3 and applaud Samsung and this beautiful work of art
27,Android,[removed],I'd love to see a unified power button + side mounted fingerprint sensors on all upcoming pixels
28,Android,[removed],Shockwave Flash games for Android (HELP)
29,Android,[removed],Android is superior
30,Android,,LG Wing Camera review: Excellent color and solid performance indoors
31,Android,"**Credits to the team at /r/PickAnAndroidForMe for compiling this information:**

* Home - https://www.reddit.com/r/PickAnAndroidForMe/wiki/index

* Smartphones 101 - https://www.reddit.com/r/PickAnAndroidForMe/wiki/smartphones101

* Top Phones - https://www.reddit.com/r/PickAnAndroidForMe/wiki/phones


***        
Note 1. Join us at /r/MoronicMondayAndroid, a sub serving as a repository for our retired weekly threads. Just pick any thread and Ctrl-F your way to wisdom! 

Note 2. Join our IRC, and Telegram chat-rooms! [Please see our wiki for instructions.](https://www.reddit.com/r/Android/wiki/index#wiki_.2Fr.2Fandroid_chat_rooms)",What should I buy Thursday (Jan 28 2021) - Your weekly device inquiry thread!
32,Android,,Google updates Play Store policies on gamified loyalty programs following confusion in India
33,Android,[removed],Best Cyrpto Currency apps?
34,Android,,Need a charger for your S21 Ultra or other phone? Well I've got you covered :D
35,Android,,RumorS: News about Android 12
36,Android,[removed],After buying and downloading off Google Play movies and tv app can't play movie.
37,Android,[removed],what is the oldest android phone do you still use in everyday life?
38,Android,[removed],God bless the bad reviews on google play store for samsung health.
39,Android,[removed],Guides to quickly get into android development
40,Android,[removed],"Purpose of this ""Scoped Storage"""
41,Android,[removed],Sim-unlock with root access
42,Android,[removed],What's up with my Gmail?
43,Android,[removed],Telegram is testing WhatsApp chat history import in their new 7.4 version (iOS only for now)
44,Android,[removed],Easter Egg Game
45,Android,,New mirror less camera
46,Android,,Creating Your First C Android App || How to make Android Apps using C
47,Android,[removed],How to get rid of more storage?
48,Android,[removed],Would you buy a Huawei phone again if Google support returns ?
49,Android,,Download Detective Story: Jack’s Case – Hidden objects .APK
50,Android,[removed],"Found an old motorola on the bus, i want to return it to its owner"
51,Android,[removed],Fast battery drain
52,Android,[removed],How do I see what apps are using a specific API? (AlarmManager)
53,Android,,"Microdroid, the miniature version of Android, has just been launched by Google"
54,Android,[removed],SAMSUNG S20 FE GLASS
55,Android,[removed],"Please my phone says 0mb available storage space and if i go to settings to try and delete it shows that there is 0mb of games, apps, mobies and tvs, documents and the rest. I dk have a few apps but they are not that heavy please how do i solve this?"
56,Android,[removed],Looking for an android document that I can't seem to find
57,Android,[removed],Newest Samsung Update
58,Android,,"Sorry Android fans, Apple is right: 1080p is all we need for smartphone screens — PCWorld"
59,Android,[removed],Did Google remove games on sale tab?
60,Android,[removed],HELPPP
61,Android,[removed],Oneplus 8t full screen issues with videos.
62,Android,[removed],Certain Android appliances have trouble connecting to high WiFi channels on both 2.4ghz and 5ghz.
63,Android,[removed],Disabling stock notification
64,Android,,Can anyone help me locate audio files that were recorded in Waze?
65,Android,[removed],Been having an issue on my Samsung Galaxy Note 10+ where the wrong app opens when I tap an app icon.
66,Android,[removed],Returning the Galaxy S21 Ultra
67,Android,[removed],Netflix MOD Apk Bypass Login Screen
68,Android,[removed],Request for Help about Android Icons
69,Android,[removed],Best Windows emulator?
70,Android,[removed],Online app voice calls keeps disconnecting and reconnecting in the other end when receiving normal cellular calls.
71,Android,[removed],"Android 11 update changes Recents panel usage, with no settings to alleviate any problems"
72,Android,,Moto G 5G review
73,Android,,YouTube Vanced 16.02.35 Released - Under-video ads fixed
74,Android,,You can now run Tasker tasks straight from Google Assistant
75,Android,[removed],How can Android phone get infected with Cerberus?
76,Android,,Android 12 working on in-depth theming system that can even recolor apps
77,Android,,How to check for saved Wi-Fi passwords on Android phones
78,Android,,How to Fix a Hacked Android Phone
79,Android,,Samsung Galaxy S21 Ultra Offers 16% Power Reduction
80,Android,,Samsung Galaxy S21 Ultra Offers 16% Power Reduction
81,Android,,Daily tasks app
82,Android,,"Synaptics Expands Family of AI-enriched, High-Performance Multimedia SoCs for Mainstream Set-Top Boxes, Smart Video Devices"
83,Android,,Samsung Galaxy S21 Teardown and Repair Assessment - Interesting Findings!
84,Android,[removed],Viaalis Watch &amp; Earn
85,Android,[removed],Blackberry
86,Android,[removed],USB-C to AUX
87,Android,[removed],Pixel 3XL screen going blank
88,Android,[removed],"Help to Rest Samsung Galaxy S7 ""Backup Password"""
89,Android,[removed],E5 Play Go vs E5 Go
90,Android,[removed],"Android 11, Data Folder"
91,Android,[removed],Help
92,Android,[removed],Leaving your Phone on sun light can cause any damage to an oled screen?
93,Android,[removed],Are there any new android phones under 5 inches with good hardware specs (and full android OS)?
94,Android,[removed],Android root?
95,Android,,Samsung Galaxy S21 Teardown and Repair Assessment - Interesting Findings!
96,Android,,Samsung Galaxy S21 Teardown and Repair Assessment - Interesting Findings!
97,Android,[removed],RCS really sucks
98,Android,[removed],Using phone with no gyroscope on pc?
99,Android,[removed],Samsung Galaxy XCover 5 on Geekbench
0,Android,[removed],Adapter To Turn My Smartphone Into a Landline Re: Fax
1,Android,[removed],Switch off phone alarm from mi band 5
2,Android,[removed],Do you use any antivirus on your android device?
3,Android,[removed],Suggested apps
4,Android,[removed],Received questionable video call from 'Intersect Group' from an unrecognized app interface - scam/malware?
5,Android,,Motorola One 5G Ace review: Just buy a Pixel 4a
6,Android,,Download English Gujarati Dictionary .APK
7,Android,[removed],Need a good ad-free weather app
8,Android,,Carl Pei founder of OnePlus launched his new company called Nothing
9,Android,[removed],"Trying to get text messages marked as delivered/read between an S9 and S10, but the option isn't there."
10,Android,[removed],How can I find the play store categories of android apps installed on my phone?
11,Android,[removed],My Recommendations to buy the Xioami Poco X3 NFC
12,Android,,Three tips that will help you to reduce your WhatsApp data usage.
13,Android,[removed],Chrome finally coloured it's black navigation bar and it's worse than when it was black
14,Android,[removed],Versus an Apple A9 chip?
15,Android,,"Firefox for Android 85.0, See All New Features, Updates and Fixes"
16,Android,,Xperia PRO Review - HDMI Port On A Smartphone. | iPhonedo
17,Android,[removed],Question about hard resetting android.
18,Android,,"Sony Xperia Pro finally launched: A phone with last year’s processor for $2,500"
19,Android,,"Sony Xperia Pro has finally launched, and it's ridiculously expensive"
20,Android,,"Sony Xperia Pro Review: Built For The Crew, Priced For The Stars"
21,Android,[removed],"To get iPhone Xs Max Totally Free you like it,you must comment. Visit the link and Then you will find offers from the network. Submit your Email Id there."
22,Android,[removed],Should I get an s21 or s21+
23,Android,[removed],Motorola Edge S is actually a flagship killer
24,Android,[removed],New Compact High-End Phones?
25,Android,[removed],Stupid youtube app
26,Android,[removed],Android 11 Xiaomi Mi A3 error (screen recording doesn't appear)
27,Android,[removed],Attaching ANY removable storage device to your Android makes it 'read only'...permanently
28,Android,[removed],Is there a worthy upgrade to the OP6?
29,Android,,Uni dissertation questionnaire on product launches!
30,Android,[removed],Galaxy S10 sent a weird message to contact
31,Android,[removed],OnePlus Security
32,Android,,Xiaomi to launch a Mi 10 refresh with Snapdragon 870 SoC
